Judul,Abstraksi
"SISTEM PERAMALAN PENJUALAN JANGKA PENDEK SPARE PART SEPEDA MOTOR MENGGUNAKAN NEURAL NETWORK
(Studi Kasus : Suzuki Kemayoran Bangkalan)","Spare part merupakan salah satu bagian penting dalam pengoperasian mesin pada sepeda motor. Peningkatan jumlah penjualan spare part yang tidak terduga saat proses tune-up menyebabkan kesulitan dalam pelayanan yang terbaik kepada konsumen. Demikian juga sebaliknya, apabila terjadi penurunan jumlah penjualan spare part, maka akan menyebabkan penumpukan spare part di gudang. Oleh karena itu diperlukan sistem peramalan yang mampu meramalkan penjualan spare part pada periode berikutnya. Sistem peramalan ini menggunakan metode Jaringan Syaraf Tiruan algoritma Propagasi Balik dengan momentum untuk meramalkan jumlah penjualan spare part  pada bulan berikutnya. Data yang telah tersimpan dihitung menggunakan epoh dan learning rate yang berbeda. Dari hasil uji coba system, maka dapat disimpulkan bahwa  dengan menggunakan semua data sebagai data training dan menggunakan learning rate 3.5 dan dengan epoh 200 akan menghasilkan tingkat kesalahan 0.0622716."
"PENGEMBANGAN MESIN PENCARIAN ANTIPLAGIASI PADA 
SIM JURNAL MAHASISWA MENGGUNAKAN ALGORITMA 
WINNOWING FUZZY K-MEANS","ABSTRAK
Penjiplakan merupakan masalah yang sering muncul dan semakin berkembang terutama dalam bidang pendidikan. Banyak karya tulis yang sebagian bahkan seluruh isinya dibuat dengan menjiplak dari karya tulis orang lain. Untuk mengatasi masalah tersebut, salah satunya solusinya adalah dengan dibuatnya aplikasi yang dapat mengelompokan dokumen dan mendeteksi penjiplakan pada dokumen tersebut. Pada tugas akhir ini dibuat aplikasi yang dapat mendeteksi penjiplakan antar dokumen yaitu dengan membandingkan antar dokumen. Dalam melakukan pendeteksian penjiplakan dokumen digunakan algoritma Winnowing. Algoritma winnowing ini berfungsi untuk melakukan proses dokumen fingerprint, yaitu dengan merubah teks menjadi sekumpulan nilai - nilai hash. Nilai hash ini yang akan digunakan untuk mendeteksi tingkat kesamaan antar dokumen. Dalam hal pengelompokan dokumen dipergunakan algoritma fuzzy k-means. Dari hasil uji coba aplikasi ini dapat diambil kesimpulan bahwa semakin besar nilai n-gram, basis, dan window maka semakin kecil hasil prosentase kemiripan antar dokumen yaitu dengan menghasilkan sebesar 4.17%, dan sebaliknya semakin kecil nilai n-gram, basis, dan window maka semakin besar  prosentase kemiripan antar dokumen yaitu dengan menghasilkan prosentase 98.49%. Pada perhitungan nilai f-measure dipengaruhi oleh keakuratan data yang diproses.
Kata Kunci : deteksi penjiplakan, cluster, f-measure"
"APLIKASI DAN DESAIN MODEL DECISION AID PELANGGAN
PADA E-COMMERCE TOKO BATIK TULIS MADURA
","Toko Batik Tulis Madura merupakan salah satu toko yang telah beroperasi sejak tahun 2011 dengan
menggunakan website e-commerce. Walau telah menggunakan model e-commerce, website tersebut memiliki
kekurangan yaitu belum ada fitur rekomndasi untuk memudahkan konsumen mencari barang yang ingin
dibelinya. Penelitian ini bertujuan membuat rekomendasi dengan decision aid untuk membantu pelanggan
dalam memilih produk di website Toko Batik Tulis Madura. Teknik pengumpulan analis data terdiri dari
Studi Literatur yang berhubungan dengan decision aid dan multi criteria, Observasi dilakukan terhadap
website Toko Batik Tulis Madura dan Interview dilakukan kepada pemilik website Toko Batik Tulis Madura.
Pembuatan implementasi pada Penelitian ini menggunakan model waterfall. Jenis decision aid yang akan
diimplementasikan adalah Multi Criteria Filtering. Metode pembobotan yang digunakan pada Multi Criteria
Filtering yaitu Decision Matrix. Hasil ujicoba dengan jumlah sample percobaan sebanyak 50 kali data
perconbaan pencarian, presentase akurasi adalah 94% dan error adalah 6%. Hasil uji kelayakan dari beberapa
kuisoner dihasilkan bahwa performa yang dimiliki tool ini cukup baik dan tool ini layak untuk diintegrasikan
serta digunakan dalam website e-commerce.

Kata Kunci: Decision, Aid, Multi, Criteria, Filtering"
Segmentasi Parasit Malaria Dalam Sel Darah Menggunakan Operasi Morfologi Dan Transformasi Watershed,"Malaria disebabkan oleh intraseluler parasit bersel tunggal yang dimiliki genus Plasmodium yang menginfeksi manusia dengan memasuki aliran darah. Dampak malaria secara geografis memiliki tingkat  transmisi tertinggi di daerah tropis dan subtropics, yaitu di negara-negara yang memiliki tingkat pertumbuhan penduduk yang besar (termasuk Indonesia). Pendeteksian parasit malaria dapat dilakukan mencari titik kromatin. Bila tidak ada titik kromatin pada sel darah merah  maka sel darah merah tersebut di anggap sebagai sel darah merah sehat. Pendeteksian titik kromatin secara manual akan memerlukan waktu yang lama. Proses segmentasi diharapkan sebagai langkah pertama untuk memudahkan pendeteksian titik kromatin karena segmentasi merupakan  salah  satu  faktor yang sangat penting dalam analisis suatu gambar. Penelitian ini melakukan segmentasi sel darah merah dengan menggunakan operasi Morfologi, deteksi tepi Canny, dan transformasi Watershed. Data yang digunakan sebanyak 15 data citra dan setiap citra akan diuji dengan empat macam operasi Morfologi kemudian citra hasil Morfologi akan diuji sebanyak 16 kali percobaan dengan parameter masking, sigma, high threshold (HT), dan low threshold (LT) dari deteksi tepi Canny. Hasil pengujian kemudian disegmentasi dengan menggunakan transformasi Watershed. Perhitungan tingkat akurasi dilakukan dengan membandingkan koordinat tiap piksel citra hasil segmentasi dengan citra ground truth  dan menghasilkan nilai rata-rata akurasi sebesar 39.3 %."
"ANALISA DATA ANTARAN POS EXPRESS MENGGUNAKAN
METODE RADIAL BASIS FUNCTION NEURAL NETWORK (RBF-NN)
STUDY PT. POS INDONESIA SURABAYA","PT. Pos Indonesia (Persero) merupakan salah satu perusahaan yang bergerak di bidang komunikasi. Saat ini,
salah produk pelayanan PT. Pos Indonesia (Persero) adalah produk Pos Express.  Produk  Pos  Express ini
diharapkan dapat diminati masyarakat dan dapat tetap bertahan bahkan  semakin menunjukkan keunggulan PT.
Pos Indonesia (Persero). Untuk  itu perlu dilakukan  analisis untuk melihat pola perkembangan, kemajuan  yang
telah ditunjukkan, bahkan untuk melihat dan memperoleh informasi, berupa peramalan  dalam waktu ke depan
terhadap produk Pos Express yang masuk  ke kantor Mail  Processing Center  (MPC) Surabaya. Dalam  hal  ini
analisis yang dilakukan adalah peramalan jumlah produk Pos Express dengan menggunakan Metode RBF-NN
(Radial Basic function neural  network).  Hasil  analisa  pada  ujicoba  yang  dilakukan  menghasilkan  nilai  yang
cukup optimal, salah satunya pada percobaan 2 inputan dengan hasil peramalan pada epoch ke-60  yang
memperoleh hasil MSE : 0.124497 dan MAPE : 15.058923 dengan hasil ramal yang berjumlah 2587.9966.
Kata kunci: Peramalan , Jaringan Syaraf Tiruan (JST), Radial Basis Function neural network (RBF-NN)."
Deteksi Manusia Menggunakan Histogram of Oriented Gradients dan Naïve Bayes Classifier,"Deteksi manusia merupakan  suatu aplikasi yang berfungsi untuk mendeteksi objek manusia dalam sebuah citra. Beberapa keuntungan yang dapat diambil dari kajian ini, yaitu penerapan pada video pengawasan. Namun, dalam video pengawasan manusia yang dideteksi dalam keadaan bergerak. Sedangkan aplikasi ini, hanya mendeteksi atau menemukan objek manusia dari background sebuah citra. Sehingga dalam proses pembuatan aplikasi ini diperlukan perhitungan – perhitungan khusus untuk mendapatkan hasil yang baik. Penelitian ini menggunakan dua tahap yaitu proses ekstraksi fitur dan klasifikasi. Proses ekstraksi fitur menggunakan metode Histogram Of Oriented Gradients (HOG). Pada prinsipnya HOG menggunakan histogram untuk memperoleh ekstraksi fitur tersebut, dengan  beberapa langkah diantarnya yaitu konversi citra, gradient compute dan normalisasi. Sedangkan pada metode Naive Bayes Classifier ini di gunakan untuk proses pengklasifikasian atau pencocokan citra. Sehingga pada hasil akhir dapat diketahui kelas citra yang telah diuji. Berdasarkan uji coba aplikasi menggunakan perhitungan distribusi gaussian probabilitas pada naive bayes classfier dengan nilai threshold = 12,13,14 dan 15 pada skenario 1, 2 dan 3 diperoleh rata – rata akurasi sebesar 68,65%.

Kata kunci : Histogram Of Oriented Gradient, Naive Bayes Classifier
"
"KLASIFIKASI STATUS GIZI BALITA MENGGUNAKAN KOHONEN SELF ORGANIZING MAP
","Aplikasi klasifikasi status gizi balita ini dibuat untuk mempermudah dilakukannya kontrol terhadap perkembangan status gizi balita terutama di tempat penelitian ini dilakukan yaitu Kecamatan Arosbaya, tepatnya di Puskesmas Arosbaya. Aplikasi ini juga dapat digunakan sebagai media informasi karena dapat diisi dengan informasi yang berkaitan dengan Puskesmas Arosbaya sendiri. Untuk menentukan status gizi balita di aplikasi ini, digunakan metode Kohonen Self Organizing Map, dengan mengambil data dari Puskesmas Arosbaya. Parameter yang digunakan ada empat, yaitu: usia, jenis kelamin, tinggi badan, dan berat badan. Karena metode K-SOM hanya dapat digunakan untuk menentukan cluster maka dibuatlah sebuah rule untuk menentukan klasifikasi data pada kelas tertentu.Umumnya untuk mengetahui status gizi balita hanya menggunakan tiga parameter, namun pada penelitian ini akan menggunakan empat parameter. Hasil klasifikasi akan dibagi menjadi 3 kelas, yaitu: kelas 1 (status gizi kurang), kelas 2 (status gizi normal), dan kelas 3 (status gizi normal). Hasil penelitian menunjukkan bahwa sebanyak 88,17% (82 balita) balita berstatus gizi kurang, 8,6% (delapan balita) balita berstatus gizi normal, dan 3,23% (tiga balita) balita berstatus gizi lebih dengan nilai learning rate dan MSE akhir masing-masing 0,09436 dan 0,000792353. Sedangkan nilai akurasi, sencitivity, dan specificity masing adalah 100%.

Kata Kunci: Kohonen Self Organizing Map, status gizi balita, Puskesmas Arosbaya
"
"SISTEM PENENTUAN STATUS GIZI PASIEN RAWAT INAP
MENGGUNAKAN METODE NAÏVE BAYES CLASSIFIER
(STUDI KASUS : RSUD DR. H. SLAMET
MARTODIRDJO PAMEKASAN)","Di Indonesia masalah perkembangan gizi adalah masalah yang
perlu perhatian lebih. Jika seseorang tidak mengetahui tentang status
gizinya, maka tidak akan dapat mengontrol berapa banyak jumlah gizi
yang dibutuhkan dalam tubuh. Dalam penelitian ini dirancang aplikasi
sistem pendukung keputusan yang digunakan untuk menentukan status
gizi pasien dan memberikan solusi makanan pada pasien sesuai riwayat
penyakit yang di derita pasien. Sistem yang dirancang ini berbasis Web,
dan memudahkan pihak admin atau ahli gizi rumah sakit dalam
penentuan status gizi pasien. Diharapkan dengan adanya aplikasi ini
dapat memberikan efisien dan efektifitas kinerja setiap pihak.
Metode yang digunakan dalam penelitian ini menggunakan
Naïve Bayes Classifier (NBC). Metode terbaru yang di gunakan untuk
memprediksi probabilitas.Metode Naïve bayes Classifier melakukan
proses penentuan perhitungan probabilitas status gizi. Dimana dicari
nilai probabilitas terbesar yang kemudian menjadi kesimpulan
penentuan status gizi.
Metode ini dapat diterapkan dalam studi kasus Sistem
Penentuan Status Gizi Pasien dengan hasil akurasi terbesar 92%.
Kata Kunci : Naïve Bayes Classifier, Sistem Pendukung Keputusan,
Status Gizi, Web"
"PENGENALAN TULISAN TANGAN HURUF ALFABET
DENGAN METODE MODIFIED DIRECTION FEATURE (MDF)
DAN LEARNING VECTOR QUANTIZATION (LVQ)","Pengenalan tulisan tangan merupakan topik penelitian yang sangat populer saat ini. Para peneliti telah banyak melakukan usaha-usaha untuk membuat sistem pengenalan tulisan tangan otomatis dengan berbagai teknik yang berbeda. Penelitian ini membahas pengembangan sistem pengenalan tulisan tangan offline yang menggunakan pencirian lokal dari karakter-karakter tulisan tangan. Salah satu faktor penentu dalam pengenalan tulisan tangan adalah model atau bentuk tulisan tangan dari penulis yang mampu dikenali. Tiap penulis pasti memiliki gaya menulis atau bentuk tulisan tangan yang berbeda. Metode yang digunakan untuk pengenalan pola tulisan tangan pada penelitian ini adalah Modified Direction Feature (MDF) untuk proses ekstraksi fitur dan Learning Vector Quantization (LVQ) untuk proses klasifikasi. Proses ekstraksi fitur pada metode MDF dilakukan dengan cara penentuan arah garis dan posisi  dari tiap-tiap piksel. Sedangkan untuk proses pelatihan data menggunakan  metode Learning Vector Quantization (LVQ), metode ini akan menghasilkan bobot yang akan digunakan untuk proses pengenalan citra huruf tulisan tangan. Dari uji coba yang dilakukan pada sistem, hasil terbaik untuk pengenalan citra huruf tulisan tangan diperoleh dengan jumlah data pelatihan sebanyak 260 citra dan data uji coba sebanyak 52 citra. Hasil akurasi sistem yang didapatkan sebesar 71,15 %.

Kata Kunci: Tulisan Tangan, Modified Direction Feature, Learning Vector Quantization"
PENGENALAN POLA SENYUMAN BERBASIS EKSTRAKSI FITUR PRINCIPAL COMPONENT ANALYSIS (PCA) DAN LINIER DESCRIMINANT ANALYSIS (LDA),"Citra senyum merupakan salah satu fitur biometrik yang dapat dijadikan sebagai bukti autentik dari seseorang. Sistem pengenalan pola (pattern recognition) secara komputerisasi, akan mengetahui identitas atau ciri diri seseorang. Pengenalan senyum telah banyak diteliti oleh banyak kalangan. Salah satu bentuk penerapan pengenalan pola senyum ini adalah mengetahui senyum seseorang sehingga nantinya senyum tersebut dapat dikenali oleh komputer dan disimpan dalam database. Terdapat dua cara untuk menentukan pola senyuman yaitu secara manual dan otomatis. Secara manual dapat dilakukan dengan kasat mata, sedangkan secara otomatis dapat di tentukan dengan menggunakan suatu sistem. Pada  Tugas Akhir ini, mengidentifikasi senyuman secara otomatis digunakan metode Principal Component Analysis (PCA) dan Linier Descriminant Analysis (LDA), dimana jenis senyuman pada tugas akhir ini dibagi menjadi lima bagian, yaitu senyum manis, senyum mengejek, senyum yang dipaksakan, senyum tertutup dan senyum terbuka. Penggunaan metode ekstraksi fitur  yang tepat dan efisien  sangat menentukan keberhasilan dari sistem pengenalan pola secara keseluruhan. Untuk metode klasifikasi pengenalan pola menggunakan Euclidean Distance atau Manhattan Distance. Dari hasil uji coba menggunakan 175 gambar data pelatihan didapatkan tingkat akurasi PCA adalah 89.8% pada ordered3. Sedangkan hasil uji coba menggunakan PCA & LDA didapatkan tingkat akurasi 100% pada ordered3."
"SISTEM PEROLEHAN CITRA BERBASIS ISI MENGGUNAKAN
GRAY LEVEL DIFFERENCE METHOD BERDASARKAN
CIRI TEKSTUR PADA POLA BATIK
","Batik adalah kerajinan yang memiliki nilai seni tinggi dan telah menjadi bagian dari budaya Indonesia sejak lama. Batik di Indonesia mempunyai beragam jenis tekstur batik, warna batik, dan pola batik yang mencerminkan asal usul daerah dari batik tersebut. Saat ini pencarian citra berbasis teks sudah tidak efektif lagi karena adanya penilaian subjektif dari pengguna dalam merepresentasikan suatu citra. Karena itu diperlukan suatu sistem yang dapat menangani pencarian citra menggunakan query berupa citra atau disebut Sistem Perolehan Citra berbasis Isi (SPCI) atau Content Based Image Retrieval (CBIR). Penelitian  ini menggunakan ciri tekstur sebagai proses pencarian kemiripan dari delapan kelas citra batik yang  berbeda yaitu: Cirebon, Bali, Bangkalan, Pamekasan, Sumenep, Yogyakarta, Solo, dan Pekalongan sebagai objek perolehan citra berbasis isi. Sistem dibangun dengan proses utamanya yaitu ekstraksi fitur tekstur dengan menggunakan metode Gray Level Difference Method (GLDM) menggunakan empat arah utama. GLDM menghitung perbedaan mutlak antara sepasang derajat keabuan yang terpisah oleh jarak dan arah tertentu. Hasil ekstraksi fitur dilakukan pengukuran jarak kemiripan menggunakan metode Euclidean Distance. Dari uji coba aplikasi menggunakan pengukuran kemiripan Euclidean Distance dengan nilai threshold=7 diperoleh akurasi presisi sebesar  61%  pada data pelatihan 168 dan data uji coba 32 dengan 10 citra yang ditampilkan. "
RANCANG BANGUN MANAJEMEN PEMBELAJARAN DAN TES TOEFL BERBASIS MOBILE,"Penggunaan teknologi mobile saat ini sangat marak, disamping keunggulannya dapat mudah bawa dibawa kemana-mana, teknologi mobile sekarang sangat mudah untuk dieksplorasi, terbukti dengan adanya smartphone yang mempunyai banyak layanan yang dapat bermanfaat bagi para penggunanya. Toefl (Test Of English As A Foreign Languange) sangat dibutuhkan dalam menghadapi kemajuan teknologi saat ini, Kurang besarnya minat masyarakat dalam belajar bahasa inggris dan mengikuti tes-tes Toefl yang ada, berpengaruh pada kemajuan teknologi.  Android  merupakan  subset  perangkat  lunak  untuk perangkat  mobile  yang  meliputi  sistem  operasi, middleware,  dan  aplikasi  inti  yang  di  release  oleh Google. Android SDK adalah  tools  API (Application Programming Interface)  yang digunakan untuk memulai membuat aplikasi pada platform Android dengan menggunakan bahasa pemrograman Java. Eclipse adalah sebuah IDE (Integrated Development Environment) yang digunakan dalam  coding  aplikasi Android nantinya. Salah satu pemanfaatan teknologi mobile yaitu dengan membuat media pembelajaran dan tes TOEFL baik soal berupa teks dan audio dengan menggunakan  teknologi Android, tentunya berbasis mobile. Dengan tes TOEFL, pembelajaran test dan kelebihan listening menu di dalam aplikasi ini, diharapkan akan dapat membatu meningkatkan pemahaman pengguna mengenai tes TOEFL.

Kata Kunci: tes TOEFL, ANDROID, Java , Mobile, SDK
"
ONTOLOGY SEMANTIC WEB UNTUK PENCARIAN TUGAS AKHIR PADA SISTEM INFORMASI TUGAS AKHIR(SIMTAK),"Kebutuhan pencarian data pada internet yang cepat dan tepat saat ini menjadi faktor penting para pengguna layanan internet. Sistem Informasi Tugas Akhir (SIMTAK) yang digunakan di Fakultas Teknik Universitas Trunojoyo Madura juga membutuhkan pencarian data yang tepat dan cepat berdasarkan konteks. Sistem pencarian yang dipakai saat ini adalah pencarian database dimana masih belum mampu memberikan hasil pencarian yang sesuai dengan konteks atau keywords yang diinputkan. Untuk memiliki kebenaran dalam sistem kecerdasan, pengetahuan perlu ditangkap, diproses, digunakan kembali, dan disampaikan. Ontologi mendukung semua tugas ini. Ontologi adalah spesifikasi dari konseptualisasi. Semantik web adalah sebuah abstrak representasi pada World Wide Web (WWW) yang berbasiskan pada sebuah standar yang didefinisikan menggunakan Resource Description Framework (RDF) dan Ontology Web Language (OWL) ide dasarnya adalah untuk membawa web memiliki definisi dan link data sehingga dapat digunakan lebih efektif untuk mencari, otomasi, integrasi dan reuse informasi pada berbagai aplikasi. Semantik web didefinisikan sebagai sekumpulan teknologi, dimana memungkinkan komputer memahami arti dari sebuah informasi berdasarkan metadata, yaitu informasi mengenai isi informasi seperti judul, pengarang, modifikasi tanggal pada halaman web, dan hak cipta pada halaman web. Dengan menggunakan semantik web, pencarian tugas akhir ini mampu memberikan hasil berdasarkan persamaan makna kata pada keyword yang diinputkan oleh user.
Kata Kunci : Mesin pencari, Semantic web, Tugas akhir.
ABSTRACT"
Aplikasi Penilaian Kinerja dengan Metodologi Customer Realtionship Management (CRM),"Setiap perusahaan mengharapkan adanya hubungan baik dengan pelanggan, begitupun dengan PT. X sebagai perusahaan yang bergerak di bidang minyak dan gas bumi Negara. Pengelolaan hubungan yang baik akan berdampak pada peningkatan citra perusahaan dimata pelanggan. Penilaian kinerja perusahaan dapat diukur dengan menggunakan kriteria dari CRM Scorecard. CRM Scorecard diambil dari Balanced Scorecard (BSC) dengan berfokus pada pelanggan. Adanya penilaian kinerja dengan metode Analytic Network Process (ANP) untuk pembobotan, PT. X dapat  menilai kinerja perusahaan dengan ditunjukkan oleh Traffic Light System sebagai hasilnya. Hasil scoring KPI menunjukkan bahwa terdapat 2 KPI yang berada pada level buruk, yaitu Ekuitas Pelanggan dan Sistem Penghargaan. Kedua KPI ini diperlukan perhatian yang lebih. Indikator yang berada pada level cukup ada 3 KPI, yaitu yaitu Perluasan Pelanggan, Teknologi Informasi, dan Struktur Organisasi. Perusahaan harus berhati-hati dengan berbagai macam kemungkinan yang dapat terjadi. Indikator yang berada pada level baik ada 9 KPI, yaitu Profitabilitas, Kesetiaan Pelanggan, Kepuasan Pelanggan, Nilai Hubungan dengan Pelanggan, Perolehan Pelanggan, Mempertahankan Pelanggan, Peranan Manajemen, Pelatihan, dan Kerjasama.

Kata Kunci:  Sistem Penilaian Kinerja, CRM Scorecard,  Analytic Network Process (ANP), Key     Performance Indicator (KPI)
"
Kalibrasi Kamera dengan Menggunakan Metode Tsai,"Teknik kalibrasi sangat berpengaruh terhadap perkembangan computer vision karena setiap proses dalam teknik kalibrasi sangat diperlukan untuk pengolahan lanjutan berbagai macam proses vision. Dengan dilakukannya kalibrasi, proses vision akan menjadi lebih mudah. Dalam prosesnya teknik kalibrasi dilakukan untuk menentukan parameter yang dapat dilakukan untuk proses vision selanjutnya diantaranya rekonstruksi 3D. Penelitian ini mencoba mengangkat kembali teknik kalibrasi kamera klasik yang sangat popular, yaitu teknik kalibrasi kamera dengan menggunakan algoritma Tsai. Sebagai simulasi, hasil parameter yang akan didapat akan digunakan untuk melakukan pengukuran tinggi obyek dengan aplikasi dan kemudian dibandingkan dengan tinggi obyek secara real. Dari hasil ujicoba, didapatkan hasil bahwa tahapan proses kalibrasi kamera dengan metode Tsai berhasil dilakukan. Kemudian data parameter yang didapat, dilakukan simulasi dengan ujicoba sebanyak 5 skenario dengan masing-masing skenario dilakukan dengan 2 percobaan. Hasil yang didapat dari hasil pengukuran dengan aplikasi ternyata masih jauh dari hasil pengukuran secara nyata. Galat relative yang didapat dari perhitungan dengan aplikasi rata-rata hanya 50.6% dari perhitungan secara nyata. Hasil ini disebabkan karena proses pengambilan data awal dengan spesifikasi yang terbatas.

Kata kunci : kalibrasi kamera, algoritma tsai, computer vision"
PENERAPAN METODE ANALYTICAL HIERARCHY PROCESS DAN FUZZY MULTI-OBJECTIVE PROGRAMMINGUNTUK PEMILIHAN SUPPLIER,"Pemilihan  supplier merupakan salah satu isu penting, karena  pemilihan supplier menjadi bagian dari sebuah  supply chain maka hubungan tersebut akan memiliki pengaruh yang sangat besar terhadap kelangsungan produksi.Pada tugas akhir ini dianalisa mengenai  Analytic Hierarchy Process (AHP) dan Fuzzy Multi-Objective Programming (FMOP) untuk pemilihan supplier di Industri Batik Podhek Pemekasan. Perhitungan AHP akan diperoleh nilai bobot tiap kriteria pemilihan supplier yang nantinya akan jadi nilai masukan pada FMOP. FMOP memberikan solusi memaksimalkan dan meminimalkan tujuan.Setelah dilakukan proses perhitungan faktor kriteria yang paling memberikan kontribusi terhadap pemilihan supplier adalah kriteria harga (0.52), kualitas (0.2) dan tingkat cacat (0.2), dan keterlambatan pengiriman (0.08). Dari hasil penelitian diperoleh bahwa supplier paling optimum adalah  Toko Utara. Untuk bahan baku kain dengan batasan pembelian 0 - 500 lembar didapatkan hasil z1 = 380, z2 = 415, z3 = 85, z4 = 250. Untuk bahan baku pewarna dan malan dengan batasan pembelian 0 - 250 kg didapatkan hasil z1 = 0, z2 = 220, z3 = 30, z4 = 125, dan z1 = 147.5, z2 = 225, z3 = 25, z4 = 125.

Kata kunci  :Supply Chain Management (SCM), pemilihan supplier, Analytical Hierarchy Process, Fuzzy, Multi-Objective Programming."
Model Penjualan Produk Unggulan Batik Khas Pamekasan Berbasis Electronic Commerce,"Kabupaten Pamekasan merupakan salah satu pusat industri dan perdagangan batik tulis yang dapat diandalkan sebagai salah satu sumber pendapatan daerah. Batik tulis Madura, khususnya batik tulis Pamekasan memiliki corak dan design yang khas. Penulis meneliti tentang pembuatan Model Penjualan Produk Unggulan Batik khas Pamekasan berbasis Electronic Commerce. Tujuan penelitian ini adalah Membangun model e-commerce yang interaktif untuk mendukung potensi perindustrian dan perdagangan kabupaten Pamekasan serta mempermudah transaksi penjualan produk unggulan batik tulis khas Pamekasan. Model e-commerce yang diterapkan adalah business to customer (B2C). Metodologi dalam mengerjakan penelitian ini adalah metode SDLC (Software Development Life Cycle), dengan menggunakan SDLC waterfall. Berdasarkan hasil analisis kuisioner yang dibagikan kepada pelanggan dan umum yaitu sebanyak 50 responden, yang mencakup beberapa pertanyaan mengenai fitur-fitur pada website. Simpulan yang dapat diambil yaitu pemodelan yang dibuat cukup baik untuk diimplementasikan menjadi website e-commerce. Hal ini dibuktikan dari hasil kuisoner menunjukkan rata-rata persentase responden yang menjawab setuju mencapai 53%. 

Kata kunci : Batik, E-Commerce, B2C, Model
"
