Judul,Abstraksi
IMPLEMENTASI  ALGORITMA PRIM  DAN DEPTH FIRST SEARCH PADA PEMBUATAN MAZE GAME BERBASIS ANDROID OS MOBILE,"Teknologi mobile game beroperating system open source berkembang dengan sangat pesat. Karena keragaman variasinya, mobile game memiliki banyak peminat dari berbagai kalangan. Hal inilah yang menjadi dasar bagi para pengembang untuk terus mengembangkan mobile game. 
Pada penelitian ini, sebuah mobile game untuk mengasah kemampuan berfikir telah dikembangkan dengan mengimplementasikan algoritma Prim dan Depth First Search. Dalam pembuatannya, algoritma Prim diterapkan pada saat pembuatan lintasan dari maze sedangkan algoritma Depth First Search diterapkan pada saat melakukan proses pencarian solusinya.
Dari hasil pengujian dapat disimpulkan bahwa algoritma Prim dan Depth First Search dapat berfungsi dengan baik pada resolusi screen 320 x 480 pixels dalam pembentukan lintasan dan pencarian solusi dari maze.
Kata kunci : Mobile Game, Android, Algoritma Prim, Algoritma Depth First Search.
"
"SISTEM PENDUKUNG KEPUTUSAN REKOMENDASI MENU DIET BAGI PASIEN RAWAT INAP MENGGUNAKAN METODE HARRIS BENEDICT DAN EUCLIDEAN (Studi Kasus : RSUD Dr. H. Moh. Anwar Sumenep)
","Pelayanan makanan bagi pasien rawat inap di Rumah Sakit mempunyai tujuan untuk memberikan menu diet yang sesuai dengan syarat gizi minimal dan sesuai dengan penyakit yang diderita pasien. 
Sampai saat ini menu yang disediakan pihak rumah sakit kurang memperhatikan kebutuhan kalori pasiennya per individu. Sehingga mengakibatkan penyediaan makanan kepada pasien tidak sesuai dengan kebutuhan kalori perhari dari pasien. Oleh karena itu dibuatlah sistem pendukung keputusan untuk rekomendasi menu diet pasien sebagai alat bantu dalam penyediaan menu makanan bagi pasien
Metode yang digunakan yaitu metode Harris Benedict untuk perhitungan total kalori pasien dan metode Euclidean untuk perankingannya, maka diharapkan aplikasi sistem pendukung keputusan yang dibuat ini mampu untuk merekomendasikan menu diet kepada pasien beserta penjelasan mengenai kebutuhan kalori perhari untuk asupan makanan perhari dan makanan yang harus dibatasi.

Kata kunci :  Sistem Pendukung Keputusan, Harris Benedict dan Euclidean
"
RANCANG BANGUN GAME PERAWATAN SAPI KARAPAN MENGGUNAKAN METODE FUZZY LOGIC,"Perkembangan game yang semakin pesat, memberikan berbagai alternative bagi peminatnya. Mulai dari bentuk game, cerita maupun media penyajian. Keberadaan game yang menggambarkan budaya Indonesia khususnya daerah kepulauan seperti Madura terhitung sedikit, sehingga dapat dirasa semakin lunturnya kebudayaan Indonesia bagi anak bangsa. Adanya peminat game yang semakin banyak dapat digunakan sebagai sarana pengenalan budaya asli Madura. Sebuah aplikasi game tentang olahraga yang sangat digemari di pulau Madura tersebut seperti Kerapan Sapi adalah sangatlah penting. Untuk itu perlu dibangun aplikasi game kerapan sapi sebagai upaya pelestarian budaya bangsa khususnya pulau Madura. Dengan upaya pembuatan game budaya maka dibangun  game perawatan sapi karapan menggunakan metode logika fuzzy (fuzzy logic), dengan menginputkan parameter kekuatan dan kesehatan sapi karapan untuk menentukan harga jual sapi karapan dalam sebuah game perawatan sapi karapan.
Kata kunci : game, kerapan sapi, perawatan sapi kerapan, budaya madura."
Perancangan Sistem Informasi Badan Kepegawaian Daerah ( BKD ) Bangkalan Sebagai Sub sistem dari E-Government Bangkalan Menggunakan TOGAF ADM ,"Kantor Badan Kepegawaian kota Bangkalan adalah instansi pemerintahan yang bergerak di bidang pelayanan kepegawaian. Untuk meningkatkan kualitas pelayanan maka perlu adanya sebuah sistem informasi yang mampu memonitoring dan membantu proses kinerja dari dinas tersebut. Oleh karena itu dalam penelitian  ini dibahas bagaimana menerapkan  Architecture Enterprise BKD Bangkalan dengan menggunakkan metode TOGAF ADM dan mengimplementa sikannya kedalam sebuah implementasi aplikasi Enterprise yang akan dibentuk menjadi satu keterpaduan dengan  E-government Bangkalan. TOGAF ADM memiliki empat komponen utama: arsitektur bisnis, arsitektur data, arsitektur teknologi dan arsitektur aplikasi. Intinya TOGAF digunakan untuk membuat Architecture Enterprise dari semua aspek tersebut. Dalam penelitian ini akan dibahas tentang perancangan sistem arsitektur Sistem informasi BKD Bangkalan sebagai sub-sistem dari E-government Bangkalan dengan menggunakan TOGAF ADM tujuannya agar dapat menghasilkan sistem aplikasi administrasi kantor Badan Kepegawaian Daerah  Bangkalan, membuat Blue Print, serta memperbaiki efisiensi, kenyamanan, serta aksesibilitas pelayanan terhadap publik agar  lebih baik. 

Kata Kunci: Arsitektur interprise, TOGAF ADM, Arsitektur bisnis, Arsitektur data, Arsitektur aplikasi, Arsitektur teknologi
"
APLIKASI METODE FUZZY ANALYTIC NETWORK PROCESS (FANP) UNTUK MENDUKUNG KEPUTUSAN PROSES PROMOSI JABATAN DI PT. SURYA MADISTRINDO PAMEKASAN,"Perusahaan pemerintah maupun swasta mempunyai tujuan yang harus dicapai. Pencapaian tujuan perusahaan dapat dilakukan dengan pemanfaatan sumber daya yang dimiliki secara optimal, salah satu sumber daya tersebut adalah sumber daya manusia yang dimiliki oleh perusahaan. Sesuai dengan peraturan yang telah ditetapkan PT. Surya Madistrindo Pamekasan dalam melakukan proses promosi jabatan, maka diperlukan kriteria-kriteria seperti aspek kapasitas intelektual, aspek sikap kerja, dan aspek perilaku yang masing-masing mempunyai sub kriteria tersendiri. Metode yang digunakan adalah metode Fuzzy Analytic Network Process (FANP). Metode FANP sendiri digunakan untuk mencari bobot prioritas kepentingan dari seluruh kriteria dan sub kriteria yang telah ditetapkan dan sebagai proses perangkingan atas bobot kriteria masing-masing data karyawan. Pembobotan diperoleh dari hasil kuesioner yang dilakukan oleh pimpinan perusahaan. Proses perangkingan dilakukan dengan cara mengalikan nilai bobot dari kriteria ke tiap-tiap sub kriteria sehingga mampu menyeleksi karyawan yang berhak menduduki jabatan yang tersedia berdasarkan kriteria-kriteria yang ditentukan. Dari hasil uji coba dalam menyelesaikan studi kasus proses promosi jabatan karyawan menghasilkan nilai akurasi sebesar 80%.


Kata kunci 	: 	Sistem Pendukung Keputusan, Promosi Jabatan,  Fuzzy Analytic Network Process (FANP)
"
EKSTRAKSI FITUR BERBASIS TWO DIMENSIONAL LINEAR DISCRIMINANT ANALYSIS  UNTUK PENGENALAN WAJAH,"Sistem pengenalan wajah adalah suatu sistem untuk mengenali identitas diri dari seseorang melalui wajah manusia. Teknologi ini mengidentifikasi bagian tubuh manusia yang unik dan tetap seperti wajah manusia. Hal khusus di bidang identifikasi dan pengenalan wajah manusia memanfaatkan pengolahan dan juga analisis citra wajah, yang akan berperan penting dalam proses pengenalan wajah manusia. Sistem ini dapat di manfaatkan dalam suatu sistem keamanan di bidang biometrika. Pada penelitian ini telah di bangun suatu perangkat lunak pengenalan citra wajah manusia menggunakan metode Two Dimensional Linear Discriminant Analysis (2DLDA) untuk menentukan karakteristik dari wajah manusia. Sedangkan pada tahap pengklasifikasian digunakan metode Angular Separation untuk mengukur kemiripan antara data pelatihan (training) dan data uji coba (testing). Melalui proses testing gambar wajah ini dapat di ketahui identitas diri dari seseorang. Dari uji coba aplikasi menggunakan klasifikasi Angular Separation di peroleh akurasi pengenalan benar sebesar  94.5%, pada  lima pose citra wajah pelatihan  dan lima pose citra wajah uji coba (testing) dengan jumlah data masing - masing dua ratus citra wajah manusia yang di ambil dari database ORL dengan menggunakan sepuluh eigen.

Kata kunci : Sistem pengenalan wajah, Two Dimensional Linear Discriminant Analysis, Angular Separation.
"
PEMANFAATAN TOGAF ADM UNTUK PERANCANGAN SISTEM INFORMASI DINAS PERINDUSTRIAN & PERDAGANGAN SEBAGAI SUB SISTEM ARSITEKTUR E-GOVERNMENT KABUPATEN BANGKALAN,"Penyusunan Sistem Informasi Dinas Perindustrian & Perdagangan (DISPERINDAG) Kabupaten Bangkalan dibuat untuk meningkatkan kualitas pelayanan dan membantu proses kinerja dari dinas tersebut. Salah satu faktor pendorong pemanfaatan sistem informasi yang lebih baik adalah semakin meningkatnya kebutuhan fungsi pelayanan yang dijalankan. Tujuan dari penerapan Arsitektur Enterprise adalah menciptakan keselarasan antara bisnis dan teknologi informasi bagi kebutuhan instansi, penerapan arsitektur enterprise tidak terlepas dari bagaimana sebuah instansi merencanakan dan merancang arsitektur enterprise tersebut. TOGAF ADM merupakan metodologi yang lengkap, banyak instansi yang tidak memahami secara jelas tentang tahapan – tahapan dari metodologi tersebut diterjemahkan ke dalam aktivitas perancangan Arsitektur Enterprise. Tahapan dalam perancangan Arsitektur Enterprise sangatlah penting dan akan berlanjut pada tahapan berikutnya yaitu rencana implementasi. TOGAF ADM memiliki empat komponen utama: arsitektur bisnis, arsitektur data, arsitektur teknologi dan arsitektur aplikasi. Pada intinya TOGAF digunakan untuk membuat Arsitektur Enterprise dari semua aspek tersebut yang menghasilkan model dan kerangka dasar dalam mengembangkan sistem informasi yang terintegrasi untuk mendukung kebutuhan Dinas Perindustrian & Perdagangan sesuai dengan Peraturan Bupati Bangkalan Nomor 38 Tahun 2010 Tentang Uraian Tugas Jabatan Struktural pada Dinas Perindustrian dan Perdagangan."
Gerak Pekerja Pada Game Real Time Strategy Menggunakan Finite State Machine,"Gerak pekerja ada pada game yang memiliki genre RTS (Real-Time Strategy). Gerak pekerja memiliki berbagai macam gerak. Oleh sebab itu dibutuhkan sebuah pendekatan konsep AI  untuk mendesain perilaku pekerja tersebut. Perilaku karakter tersebut harus ditambahi dengan AI (Artifical intelegent) agar perilakunya menjadi lebih hidup dan realistis.
Dalam penelitian ini AI yang digunakan adalah Finite State Machine. Finite State Machine digunakan untuk menentukan gerak pekerja terhadap parameter-parameter yang digunakan sebagai dasar gerak yang akan dilakukan . Selanjutnya akan disimulasikan pada game RTS dengan menggunakan game engine.
Hasil yang di peroleh dalam penelitian ini adalah penerapan metode Finite State machine untuk menentukan gerak pekerja berdasarkan parameter jumlah harta, prajurit, kondisi bangunan, dan stockpile (jumlah resources yang di bawa). 

Kata kunci : Game, Real-Time Strategy, Gerak Pekerja, Finite State Machine.
"
RANCANG BANGUN APLIKASI PEMILIHAN TEKNIK REKAYASA KEBUTUHAN MENGGUNAKAN METODE SELF ORGANIZING MAP BERBASIS EUCLIDEAN DISTANCE DAN CANBERRA DISTANCE MATRIX,"Penyusunan Sistem Pendukung Keputusan pemilihan teknik rekayasa kebutuhan dibuat untuk membantu pengembang perangkat lunak dalam membangun sebuah proyek perangkat lunak. Pemilihan teknik rekayasa kebutuhan umumnya berdasarkan pada pilihan system dan analis yang bersangkutan daripada berdasarkan karakteristik teknik rekayasa kebutuhan yang sesuai pada proyek perangkat lunak tersebut. Untuk dapat menghasilkan perangkat lunak yang baik maka proses evaluasi dan pemilihan teknik rekayasa kebutuhan merupakan salah satu tahap yang sangat penting dalam sebuah proyek pengembangan perangkat lunak.
	Didalam SPK ini dilakukan proses pemilihan antara teknik rekayasa kebutuhan dan kriteria atribut project yang diinginkan oleh pengembang perangkat lunak. Selanjutnya dilakukan proses clustering menggunakan metode Self Organizing Map (SOM). Parameter yang digunakan dalam adalah distance matrix karena paling tepat digunakan untuk menangani data multi dimensional. Euclidean dan Canberra adalah jenis distance matrix yang lazim digunakan karena tingkat akurasinya yang baik untuk menangani kasus data riil.
Hasil akhir yang diperoleh yaitu membandingkan hasil clustering menggunakan metode SOM berbasis Euclidean Distance dan Canberra Distance matrix. Sehingga menghasilkan teknik rekayasa kebutuhan yang efisien, obyektif dan sesuai dengan karakteristik proyek perangkat lunak.
Kata Kunci : Sistem Pendukung Keputusan, Teknik Rekayasa Kebutuhan, Clustering, Self Organizing Map, Canberra Distance matrix"
APLIKASI KONTROL DAN MONITORING JARINGAN KOMPUTER BERBASIS MOBILE,"Berjalannya koneksi jaringan komputer dengan lancar dan tanpa gangguan merupakan harapan seluruh penggunanya,
terutama pihak yang bertanggung jawab pada bidang itu, yakni administrator jaringan. Namun tidak selamanya koneksi
jaringan dapat berjalan dengan lancar tanpa adanya gangguan. Kenyataan di lapangan terutama pada jaringan komputer skala
besar, berpotensi besar terjadi gangguan atau bahkan kerusakan koneksi jaringan komputer.
Hal ini rata - rata disebabkan banyaknya penggunaan serta padatnya traffic data dalam jaringan komputer itu sendiri.
Oleh karena itu untuk menjaga bahkan meningkatkan kualitas layanan koneksi jaringan maka diperlukan adanya akses kontrol
dan monitoring pada level administrator jaringan secara real-time berbasis mobile, yang dapat mengatur dan mengetahui
informasi tentang koneksi jaringan dan dapat diakses setiap saat.
Pihak administrator jaringan dituntut untuk terlebih dahulu mengetahui adanya gangguan atau bahkan terputusnya
koneksi jaringan walaupun administrator tidak berada di tempat kontrol dan monitoring, Dengan adanya sistem kontrol dan
monitoring berbasis mobile, diharapkan dapat membantu tugas administrator dalam mengontrol dan memantau jaringan serta
dalam mengambil kebijakan atas node – node yang terkoneksi pada jaringan yakni memanajemen koneksi, port dan bandwidth
setiap saat dan secara mobile. agar dengan segera dapat melakukan pembenahan ketika terjadi gangguan jaringan sebelum
pemakai jaringan (klien) melakukan pengaduan atas adanya gangguan.
Kata Kunci : Administrator Jaringan, Koneksi Jaringan, Akses Kontrol dan Monitoring."
"PERANCANGAN DAN IMPLEMENTASI SISTEM DATABASE 
TERDISTRIBUSI MENGGUNAKAN ORACLE STUDI KASUS 
SIAKAD UNIVERSITAS TRUNOJOYO","Sistem  informasi  akademik  (SIAKAD) merupakan  sistem  informasi  yang  berfungsi  menangani pengelolaan  dan  penyajian  data-data  akademik,  yang  oleh pihak  fakultas  SIAKAD  dianggap  sangat  penting  dalam memberikan  pelayanan  mahasiswa  yang  membutuhkan informasi akademik. Di Universitas Trunojoyo telah tersedia SIAKAD,  namun  masih  menggunakan  database  terpusat. Sistem seperti ini memberikan kelebihan yaitu perawatannya mudah  selain  itu  juga  membutuhkan  sedikit  biaya,  namun sistem  tersebut  juga  berpotensi  mengahadapi  kendala-kendala  yaitu  dalam  proses  transaksi  data  karena  padatnya jaringan yang menuju database SIAKAD, kelambatan dalam pemrosesan  respon  query  dikarenakan  data  yang  tersimpan semakin besar dan pemrosesan semakin kompleks, dan  juga memiliki kelemahan dalam hal ketersediaan data. Untuk  itu sistem  seperti  ini  memerlukan  pengembangan  sistem database  yang  lebih  baik  dengan  menggunakan  sistem databases  terdistribusi  pada  masing-masing  fakultas  yang dapat  dijadikan  solusi  bagi  permasalahan  di  atas.  Karena dalam basisdata terdistribusi terdapat keuntungan yang tidak dimiliki oleh basisdata  terpusat yaitu pengawasan distribusi, reability,  availability,  kecepatan  dalam  pemrosesan  query dan otonomi local"
DETEKSI COREPOINT SIDIK JARI MENGGUNAKAN METODE GEOMETRY OF REGION TECHNIQUE (GR),"Sidik jari adalah salah satu karakteristik fisik manusia yang saat ini banyak digunakan untuk identifikasi manusia, karena sidik jari mempunyai karakteristik yang tidak dapat berubah kecuali jika luka atau rusak akibat kecelakaan. Sidik jari sangat diperlukan untuk berbagai kasus tindak kriminal, seperti pencurian, kecurangan administrasi. Sehingga adanya proses pendeteksian sidik jari dapat memudahkan pihak-pihak yang berwajib untuk menangani beberapa kasus tersebut. Proses pendeteksian ini di lakukan dalam program komputer dengan melakukan beberapa tahap perhitungan. Penentuan titik tengah atau yang biasa di kenal dengan Corepoint adalah sebuah proses awal yang sangat berperan penting dalam proses identifikasi manusia. Terdapat dua cara untuk menentukan Corepoint atau titik tengah sidik jari yaitu secara manual dan otomatis. Secara manual dapat di lakukan dengan kasat mata. sedangkan secara otomatis dapat di tentukan dengan menggunakan suatu sistem. Pada Tugas Akhir ini untuk menentukan Corepoint sidik jari secara otomatis digunakan metode Geometry Of Region Technique (GR).Citra yang digunakan pada Tugas Akhir diperoleh dari “database FVC-2002 fingerprint-bitmaps”. Hasil uji coba sistem yang terbaik untuk deteksi Corepoint sidik jari menggunakan metode Geometry Of Region Technique (GR) dengan M0=50 dan V0=50 pada proses normalisasi dan menggunakan ukuran blok 3 x 3 pixel. Hasil akurasi sistem yang didapatkan sebesar 70%.
Kata Kunci : Sidik jari, Corepoint, Geometry Of Region Technique (GR), Normalisasi"
"RANCANG BANGUN APLIKASI PROXY SERVER UNTUK
ENKRIPSI KODE HTML MENGGUNAKAN
ALGORITMA BLOWFISH","Web server adalah sebuah perangkat lunak server yang berfungsi
menerima permintaan HTTP atau HTTPS dari web client dan
mengirimkan jawaban dalam bentuk halaman-halaman web yang
umumnya berbentuk dokumen HTML. Dokumen HTML yang dikirim
merupakan dokumen yang dibentuk dari bahasa markup yang plaintext.
Artinya, dokumen berisi kode-kode HTML murni tanpa proses enkripsi.
Tujuan dari penelitan ini adalah membuat sebuah aplikasi proxy
server yang menerima permintaan HTTP dari web client dan
meneruskannya ke web server. Kemudian aplikasi ini akan menerima
respon dari server dan melakukan proses enkripsi pada dokumen HTML
terlebih dahulu. Sehingga dokumen HTML yang dikirim kepada web
client sudah berbentuk dokumen HTML yang terenkripsi. Web client
disini bisa berupa aplikasi seperti Internet Explorer, Mozilla Firefox,
atau Opera. Aplikasi-aplikasi tersebut biasa dikenal dengan sebutan web
browser.
Ketika web browser menerima dokumen HTML yang terenkripsi
dari aplikasi proxy server, maka JavaScript Engine yang ada di web
browser akan melakukan proses dekripsi sekaligus rendering sehingga
dokumen akan ditampilkan sesuai dengan aslinya. Namun apabila kode
dari dokumen HTML tersebut dilihat melalui menu view source yang
ada di web browser akan didapatkan dokumen HTML yang tetap
terenkripsi."
SISTEM AUGMENTED REALITY ANIMASI BENDA BERGERAK MENGGUNAKAN FLARTOOLKIT,"Seiring perkembangan teknologi yang ada didunia, muncul teknologi yang disebut augmented reality. Augmented Reality (AR) merupakan upaya untuk menggabungkan dunia maya dan dunia virtual yang dibuat melalui komputer sehingga batas antara keduanya menjadi sangat tipis. Head-Mounted Display (HMD) merupakan contoh hasil dari penelitian tentang Augmented Reality, ini merupakan satu-satunya peralatan dasar dalam teknologi-teknologi terbaru. Seiring berjalannya waktu, augmented reality berkembang pesat sehingga memungkinkan pengembangan aplikasi ini di berbagai bidang.

Untuk mengembangkan AR banyak sekali library pendukung yang dapat digunakan. FlarToolKit adalah salah satunya. FlarToolKit merupakan library pendukung augmented reality pada platform flash.

Berdasarkan sistem AR animasi benda bergerak yang dibuat adalah animasi bergerak permainan pingpong dimana telah dikolaborasikan dengan augmented reality untuk menggerakkan setiap langkah dari playernya. Interaksi antar obyek tersebut dapat dilihat dari gerak bola yang dapat dipukul dengan obyek virtual yang ditampilkan melalui augmented reality.
"
"SISTEM PENDUKUNG KEPUTUSAN OPTIMASI PENJADWALAN MATAKULIAH UNTUK PENGGUNAAN RUANGAN KULIAH BERSAMA DI UNIVERSITAS TRUNOJOYO MADURA MENGGUNAKAN ALGORITMA  
GENETIKA","Penjadwalan  kuliah  di  Perguruan  Tinggi  merupakan  masalah yang  kompleks.  Dalam  permasalahan tersebut  terdapat  beberapa variabel  yang  harus  dipertimbangkan  supaya  mendapatkan  jadwal  yang 
optimal. Di dalam penyusunan jadwal kuliah ini terdapat sangat banyak kemungkinan  yang  selayaknya  dicoba  untuk  menemukan  penjadwalan yang  terbaik.  Karena  itu  dibutuhkan  metode  optimasi  yang  dapat diterapkan  untuk  mengerjakan  penjadwalan  mata  kuliah  ini.  Metode yang  dapat  digunakan  untuk  menyelesaikan  permasalahan  tersebut adalah  dengan  menggunakan  Algoritma  Genetika.  Tugas  Akhir  ini 
bertujuan  untuk  membuat  suatu  sistem  yang  dapat  membuat  jadwal matakuliah  secara  otomatis  dan  hasilnya  optimal.  Dari  hasil  penelitian yang  dilakukan  algoritma  genetika  mampu  membuat  jadwal  dengan 
optimal  yang  dibuktikan  dari  nilai  fitness  yang memiliki  nilai  1  secara otomatis  jadwal  yang  dibentuk  akan  optimal.  Semoga  adanya  aplikasi ini  diharapkan  bisa  mempermudah  didalam  pembuatan  penjadwalan 
matakuliah dengan mudah dan cepat. 
 
Kata Kunci: Algoritma Genetika, Optimasi,  Penjadwalan."
RANCANG BANGUN APLIKASI INTRUSION PREVENTION SYSTEM PADA JARINGAN BERBASIS PROTOKOL TCP/IP MENGGUNAKAN SNORT DAN IPTABLES,"Dalam setiap perusahaan tentunya memiliki data penting berkaitan dengan kegiatan bisnis mereka yang perlu dijaga dan diamankan dari orang yang tidak berhak mengaksesnya. Seringkali  muncul aksi ilegal yang mencoba merusak server bahkan sampai mencuri data perusahaan bisa mengakibatkan kesalahan fatal terhadap kelancaran kegiatan bisnis perusahaan disebabkan data yang tidak valid lagi. Menyikapi masalah tersebut, maka diperlukannya sistem monitoring keamanan yang mampu mengamankan server dari tindakan penyusupan. Intrusion Prevention System (IPS) merupakan solusi yang mampu memberikan keamanan pada jaringan server dari tindakan penyusupan. IPS ini mengembangkan Snort sebagai fungsi pendeteksi yang dikombinasikan dengan IPTables Firewall sebagai pencegah adanya penyusupan. IPS ini juga dilengkapi dengan user interface BASE (Basic Analysis and Security Engine)  dan manajemen rule sehingga memudahkan admin untuk memonitor sistem keamanan dari tindakan penyusupan ke jaringan server. Snort akan membuat alert ketika terdeteksi adanya serangan yang disimpan dalam log Snort dan memerintahkan IPTables untuk melakukan drop terhadap alamat penyerang. Kemudian detail serangan bisa dilihat pada tampilan user interface BASE. Dari hasil pengujian, didapatkan bahwa Snort dan IPTables telah bekerja dengan baik menjadi IPS yang mampu memberikan respon secara cepat ketika terdeteksi adanya serangan. Waktu tanggap rata-rata kurang dari 5 detik, dari awal serangan sampai terdeteksinya alert."
APLIKASI CITRA MOSAIK PANORAMIK MENGGUNAKAN METODE WATERSHED,"Citra digital banyak dimanfaatkan dalam berbagai aspek kehidupan,oleh karena itu membutuhkan tampilan citra yang yang dapat merepresentasikan objek yang terdapat dalam citra tersebut. Salah satu permasalahan yang ada saat melakukan pengambilan gambar (citra) adalah kemampuan untuk mengambil gambar yang sangat luas sehingga gambar harus diambil beberapa kali yang menyebabkan gambar atau objeknya menjadi terpisah-pisah. Untuk mengatasi permasalahan ini diperlukan proses penggabungan citra. Dan dalam penelitian ini akan digunakan metode Watershed. Dalam metode ini terlebih dahulu ditentukan titik korespondensi pada masing-masing citra kandidat, kemudian daerah hasil korespondensi tersebut akan disegmen menggunkan metode Watershed dan hasil segmentasinya digunakan untuk mencari Region cut sebagai acuan penggabungan citra. Proses penggabungan citra ini dsebut dengan mosaic panoramik. Hasil dari penelitian ini menunjukkan citra panorama yang ideal dapat dperoleh dengan menggunakan citra masukan yang mempunyai kesamaan obyek dan titik korespondensi dipilih pada obyek yang sama diantara dua citra masukan tersebut.

Kata kunci :Citra Panorama, MosaikPanoramik, Metode watershed
"
ANALISA VALIDITAS PENERIMA BEASISWA MENGGUNAKAN METODE ANALYTIC NETWORK PROCESS DAN TOPSIS,"Beasiswa adalah pemberian berupa bantuan keuangan yang diberikan kepada perorangan yang bertujuan untuk digunakan demi keberlangsungan pendidikan yang ditempuh. Program beasiswa diadakan untuk meringankan beban mahasiswa dalam menempuh masa studi kuliah khususnya dalam masalah biaya. Fakultas Teknik Universitas Trunojoyo memiliki program beasiswa yang harus diberikan kepada yang berhak menerima. Diantaranya Beasiswa Bantuan Belajar Mahasiswa (BBM), Beasiwa Peningkatan Prestasi Akademik (PPA) dan setiap jenis beasiswa memiliki kriteria atau faktor bobot yang berbeda. Tetapi dalam melakukan seleksi beasiswa tentu akan mengalami kesulitan karena banyaknya pemohon, banyaknya kriteria dan masih menggunakan cara manual yang mengakibatkan kurang efektifnya keputusan. Untuk membantu dalam menetapkan seseorang yang layak menerima beasiswa maka dibutuhkan sistem pendukung keputusan. Metode yang digunakan dalam penelitian ini adalah Analytic Network Process (ANP) dan Technique Order Preference by Similarity To Ideal Solution (TOPSIS). Pada penelitian ini akan diangkat suatu kasus yaitu menganalisa validitas alternatif terbaik penerima beasiswa berdasarkan kriteria-kriteria yang telah ditentukan dengan menggunakan metode ANP kemudian dicari solusi pengurutan dengan menggunakan metode TOPSIS. Berdasarkan hasil uji coba sistem, terdapat perbedaan selisih hasil rekomendasi dari sistem terhadap data aktual pemenang beasiswa PPA jurusan informatika, yaitu 78,57%. Sedangkan selisih hasil rekomendasi dari sistem terhadap data aktual pemenang beasiswa BBM jurusan informatika, yaitu 80,95%.

Kata kunci: ANP, TOPSIS, MCDM, pengambilan keputusan multi kriteria, seleksi beasiswa.
"
