Judul,Abstraksi
ANALISIS DAN PENERAPAN ALGORITMA PARTICLE SWARM OPTIMIZATION PADA OPTIMASI PENJADWALAN MATA KULIAH DI JURUSAN TEKNIK INFORMATIKA UNIVERSITAS TRUNOJOYO MADURA,"Penjadwalan mata kuliah di program studi Teknik Informatika Universitas Trunojoyo Madura dilakukan pada setiap pergantian semester. Beberapa faktor yang mendukung penjadwalan mata kuliah antara lain dosen, mahasiswa, mata kuliah, serta jumlah ruang dan waktu yang tersedia. Permasalahan optimasi penjadwalan merupakan masalah yang sudah umum dan telah dipelajari dalam waktu yang lama, namun perlu dicari metodologi atau pendekatan teknis dan sampai saat ini telah berkembang beberapa solusi alternatif yang ditawarkan. Dalam penelitian ini digunakan algoritma Particle Swarm Optimized (PSO) utnuk melakukan optimasi pada jadwal kuliah. Karena algoritma PSO memiliki tool-tool yang cukup handal dengan penggunaan yang cukup mudah. Hasil penelitian menunjukkan bahwa algoritma Particle Swarm Optimiztion dapat diterapkan  dengan lebih baik pada optimasi penjadwalan mata kuliah dengan memaksimalkan penggunaan parameter-parameter dari algoritma Particle Swarm Optimiztion yaitu apabila nilai w besar maka untuk mengoptimalkan nilai velocity gunakan nilai kecil pada c1 dan c2, begitu juga sebaliknya bila nilai w kecil maka gunakan nilai besar pada c1 dan c2."
"Rancang Bangun Sistem Pendukung Keputusan Penentuan Pemberian Bantuan RASKIN Menggunakan Metode SMARTER
(Studi Kasus : Kecamatan Batuan Kabupaten Sumenep)
","Seiring dengan perubahan dalam paradigma pembangunan ekonomi yang tidak berfokus dalam penanggulangan masalah kemiskinan, maka sudah sepantasnya apabila pemerintah dituntut untuk dapat mengentaskan masalah kemiskinan melalui program-program pengentasan kemiskinan. Salah satu dari banyak program pengentasan kemiskinan yang dilaksanakan oleh pemerintah yaitu program RASKIN. Metode yang dipakai dalam penelitian ini adalah SMARTER (Simple Multi Attribute Rating Technique Exploiting Ranks). Metode SMARTER merupakan bagian dari metode Multiple Criteria Decision Making (MCDM). Metode ini dipilih karena metode SMARTER merupakan suatu bentuk model pendukung keputusan yang digunakan dalam pengambilan keputusan dengan kriteria yang beragam yang nantinya dapat digunakan untuk memecahkan masalah pengambilan keputusan. Penelitian yang dilakukan di Kecamatan Batuan, Kabupaten Sumenep ini menggunakan parameter kemiskinan yaitu sumber air minum, berapa kali makan per hari, kemampuan membeli daging, Ayam, susu per minggu, bahan bakar masak, jumlah pakaian baru, sumber penerangan, aset minimal, lapangan pekerjaan, tempat buang air besar, jenis lantai rumah, jenis dinding rumah, luas lantai rumah, kemampuan berobat jika sakit dan ijazah terakhir.  Pada penelitian ini, sistem pendukung keputusan menggunakan metode SMARTER mampu menganalisa kriteria yang nantinya dapat menentukan penduduk mana yang layak menerima bantuan RASKIN. Sistem ini memiliki tingkat akurasi 80,5% jika dibandingkan dengan data rill pada tahun 2012.
   
Kata Kunci : RASKIN, Sistem Pendukung Keputusan. SMARTER
"
RANCANG BANGUN APLIKASI SEARCH ENGINE DAN SISTEM PENDETEKSI PLAGIARISME MENGGUNAKAN METODE LSA-SOM,"Plagiarisme adalah mencuri gagasan, kata-kata, kalimat atau hasil penelitian orang lain dan menyajikannya seolah-olah sebagai karya sendiri. Metode LSA merupakan salah satu metode dari beberapa metode untuk pendeteksian plagiarisme. Metode Latent Semantic Analysis (LSA) adalah sebuah teori dan metode untuk menggali dan mempresentasikan konteks yang digunakan sebagai sebuah arti kata dengan memanfaatkan komputasi statistik untuk sejumlah corpus yang besar. Penggunaan LSA konvensional bersifat sekuensial dikarenakan masih belum adanya klasterisasi sehingga proses analisa akan dilakukan secara global pada keseluruhan dokumen yang tentunya memerlukan waktu komputasi yang besar. Untuk itu dapat digunakan teknik klasifikasi tak terawasi seperti penggunaan Self Organizing Map (SOM) dan pengujian similaritas secara global hanya dilakukan pada centroid masing-masing kluster untuk kemudian dilakukan pengujian similaritas secara lokal pada klaster yang terpilih yang menjadi bagian dari klaster tersebut. Pada hasil penelitian  LSA-SOM memiliki rata-rata precision 94.4% dan recall 64.04%. 
Kata kunci : Cosine Similarity, Latent Semantic Analysis, plagiarisme Self Organizing Map, Singular Value Decomposition
"
Rancang Bangun CRM Berbasis SMS Gateway disertai Peramalan Pergudangan dengan Metode Fuzzy Time Series,"KUB Rumput Laut Mitra Bahari adalah suatu perusahaan yang bergerak di bidang produksi rumput laut. Selama ini sistem produksi yang dilakukan didasarkan pada inventori atau stok gudang. Produksi terus berlangsung tanpa melihat permintaan penjualan. Sebagai akibatnya sering terjadi permintaan atau penjualan yang melebihi stok sehingga KUB Rumput Laut Mitra Bahari tidak dapat memenuhi permintaan tersebut. Sering juga terjadi permintaan penjualan jumlahnya lebih sedikit dari hasil produksi sehingga terdapat banyak sisa produk yang tidak terjual. Selain itu, pihak perusahaan juga masih belum memanfaatkan hubungan CRM antara pelanggan dengan perusahaan berbasis SMS Gateway, yang dapat mempercepat dan mempermudah hubungan antara pelanggan dengan perusahaan.
Oleh karena itu, untuk mengatasi beberapa masalah tersebut, pada tugas akhir ini dibuat aplikasi CRM berbasis SMS Gateway disertai peramalan pergudangan dengan metode Fuzzy Time Series. Hubungan CRM berbasis SMS Gateway antara pelanggan dan perusahaan dapat mempermudah dan mempercepat hubungan antara pelanggan dengan perusahaan. Perusahaan akan mengetahui apa yang diharapkan dan diperlukan pelanggannya. Disamping itu dalam penelitian ini juga dibuat aplikasi peramalan pergudangan yang nantinya akan ditindak lanjuti menjadi informasi peluang memasok bahan mentah kepada pemasok berbasis SMS Gateway. Dengan adanya hasil peramalan tersebut, pihak perusahaan dapat memperkirakan jumlah stok data produksi yang dibutuhkan pada periode berikutnya.

Kata Kunci: CRM, pergudangan, Fuzzy Time Series, SMS Gateway.
"
"Pengenalan Tipe Huruf Aksara di Indonesia Menggunakan Edge Direction Matrix (Batak Toba, Kaganga, Carakan, Had Lampung)","Optical Font Recognition (OFR) merupakan  teknik analisa tipe tulisan pada teks atau dokumen yang sangat diminati. Penelitian ini menguji keefektifan penggunaan analisa ekstraksi fitur global berdasarkan analisa statistik pada perilaku piksel tepi citra biner OFR. Salah satu metode OFR berdasarkan pendekatan global adalah Edge Direction Matrix (EDM).  EDM merupakan sebuah metode baru pada ekstraksi fitur untuk citra biner dimana perilaku piksel tepi antara background putih dan pola hitam diambil sebagai fitur pola. Kemudian nilai tersebut disimpan pada matrik EDM1 dan EDM2  sesuai dengan delapan arah sudut. Dari nilai matrik yang terbentuk kemudian akan dihitung berdasarkan enam persamaan EDM sehingga membentuk 22 nilai fitur. Dalam hal ini dataset yang digunakan untuk pengujian berjumlah 1200 data citra yang berasal dari empat aksara kuno yang ada di Indonesia yaitu Aksara Carakan, Aksara Batak Toba, Aksara Had Lampung dan Aksara Kaganga. Setiap aksara mempunyai empat style font yaitu Bold, Bold-Italic, Italic dan Regular. Penelitian ini menggunakan metode Euclidean Distance dalam proses klasifikasi dan pengenalan tipe tulisan sehingga mendapatkan hasil akurasi pengenalan tertinggi mencapai 83,7% pada skenario ke 5 dengan jumlah data ujicoba sebanyak 208 data. "
Sistem Pendukung Keputusan Penentuan Prioritas Produk Unggulan Daerah Dengan Menggunakan Metode F-AHP Studi Kasus Kabupaten Bangkalan,"Persaingan produk unggulan daerah semakin ketat seiring dengan terus meningkatnya laju pertumbuhan industri dan teknologi. Persaingan ini mengakibatkan setiap industri harus lebih jeli dalam merumuskan strategi kebijakan. Pengambilan keputusan untuk menentukan prioritas produk unggulan daerah yang sesuai dengan kebutuhan dan kemampuan diperlukan suatu keputusan yang akurat dan efektif agar tidak salah memilih dan meminimalisir kerugian baik dari segi biaya maupun waktu.
Dalam penelitian ini digunakan metode Fuzzy Analytic Hierarchy Process (FAHP) yang memiliki kelebihan dimana perkiran skala yang digunakan bersifat tidak tunggal. Maka Fuzzy AHP biasa digunakan untuk mengurangi faktor subyektivitas pada kriteria atau sub kriteria yang ada. Dengan menggunakan metode ini, diharapkan dapat dikembangkan software sistem pendukung keputusan yang dapat digunakan oleh suatu instansi, karena instansi cukup memilih beberapa barang yang akan menjadi alternatif pemilihan dan memberikan nilai bobot pada perbandingan alternatif dan kriterianya, adapun kriteria tersebut adalah omset, tenaga kerja, target pasar, asal bahan baku, badan usaha.

Kata Kunci: sistem pendukung keputusan, produk unggulan, metode FAHP."
RANCANG BANGUN APLIKASI ENKRIPSI  SMS MENGGUNAKAN METODE RC4 BERBASIS PLATFORM ANDROID,"Perkembangan teknologi informasi beberapa dekade ini telah membuat perubahan yang sangat pesat. Dengan adanya teknologi informasi ini maka penyampaian informasi jarak jauh pun semakin mudah. Salah satu teknologi telekomunikasi yang menjanjikan kecepatan dalam penyampaian adalah Sort Message Service (SMS), dengan menggunakan teknologi SMS pengguna dapat bertukar pesan dengan orang lain secara cepat dan mudah. 
Pada   tugas   akhir   ini   dikembangkan   sebuah   aplikasi   pada   telepon   selular   untuk memodifikasi pesan SMS menjadi cipherteks agar isi informasi dari SMS tersebut tidak diketahui oleh orang lain. Untuk pengiriman SMS sistem mengenkripsi pesan menjadi cipherteks menggunakan key yang diinputkan oleh pengirim kemudian mengirimkan ke nomor tujuan. Untuk penerimaan SMS sistem mendekripsi cipherteks menjadi plainteks menggunakan  key  yang  diinputkan  oleh  penerima  kemudian  menampilkan  pesan  asli kepada penerima. Aplikasi ini dapat dimanfaatkan oleh seseorang yang ingin mengirimkan suatu informasi rahasia kepada orang lain melalui SMS tanpa takut informasi dari pesan tersebut akan diketahui oleh orang lain.
Metode yang digunakan sistem dalam mengenkripsi dan mendekripsi pesan adalah metode enkripsi RC4 dan implementasinya menggunakan bahasa pemrograman Java SE Development Kit 7 dengan tools Application Programing Intervace (API) android SDK.

Kata kunci: sort message service (SMS), enkripsi, dekripsi, RC4, Android.
"
"SISTEM PEROLEHAN CITRA BERBASIS ISI
MENGGUNAKAN GRLM BERDASARKAN CIRI TEKSTUR PADA POLA BATIK
","Batik merupakan seni yang paling penting dalam kehidupan masyarakat Indonesia. Keanekaragaman batik datang dari beberapa wilayah dan provinsi sehingga menyimbolkan karakteristik ciri pola batik yang berbeda-beda dari masing-masing daerah tempat batik tumbuh dan berkembang. Tugas akhir ini telah berhasil membuat suatu Sistem Perolehan Citra berbasis Isi (SPCI) dengan ciri tekstur yang bertujuan untuk mengetahui ciri dari pola batik tersebut. SPCI merupakan metode atau teknik pencarian gambar citra yang mirip (similar) dengan melakukan perbandingan antara citra query dengan citra yang ada dalam basis data. Pada penelitian  ini menggunakan ciri tekstur sebagai proses pencarian kemiripan dari delapan wilayah citra batik yang  berbeda yaitu: Cirebon, Bali, Bangkalan, Pamekasan, Sumenep, Yogyakarta, Solo, dan Pekalongan sebagai obyek perolehan citra berbasis isi. Sistem dibangun dengan proses utamanya yaitu ekstraksi fitur tekstur dengan menggunakan metode Gray Level Run Length Matrix (GLRM). GLRM dilakukan dengan membuat rangkaian pasangan nilai (i,j) pada setiap baris piksel dengan arah tertentu. Hasil ekstraksi fitur selanjutnya dilakukan pengukuran jarak kemiripan menggunakan metode Euclidean Distance. Dari uji coba aplikasi menggunakan pengukuran kemiripan Euclidean Distance dengan nilai threshold=145 diperoleh akurasi presisi sebesar  0.53  pada data pelatihan 184 dan data uji coba 16 dengan jumlah citra yang ditampilkan 10. 

Kata Kunci: Tekstur, Sistem Perolehan Citra berbasis Isi, Gray Level Run Length Matrix, Euclidean Distance
"
Sistem Pendukung Keputusan Rehabilitasi Bangunan Bersejarah Dengan Menggunakan Metode Fuzzy Analytical Hierarchy Process (F-AHP) Berbasis Spasial.,"Bangunan bersejarah merupakan salah satu peninggalan cagar budaya kota lama yang banyak mengandung cerita pada jaman perang kemerdekaan dahulu yang perlu dilestarikan dan nilai tambah untuk kepariwisataan kota surabaya. Karakteristiknya selalu mengalami penurunan kondisi yang diindikasikan dengan terjadinya kerusakan pada fisik bangunannya. Untuk mempertahankan kondisi bangunan sesuai dengan umur rencana yang telah direncanakan, maka selama masa bangunan tersebut berdiri perlu kegiatan rehabilitasi berupa pemeliharaan dan pembangunan berdasarkan tingkat kerusakan bangunan yang termasuk dalam evaluasi analisis multi kriteria.
Namun sehubungan dengan keterbatasan anggaran, maka perlu dibuat prioritas berdasarkan berbagai kriteria dalam penanganan bangunan melalui mekanisme perencanaan pembangunan daerah. Penelitian menggunakan metode Fuzzy Analytical Hierarchy Process (FAHP) yang dikembangkan oleh Thomas L Saaty. Prioritas rehabilitasi bangunan akan ditampilkan melalui MapServer yang setiap letak bangunannya yang mengindikasikan rusak sedang, dan rusak berat.

Kata Kunci: Bangunan bersejarah, Analisis Multi Kriteria, Fuzzy AHP, MapServer."
SISTEM PENENTU CALON PENERIMA BEASISWA IKSASS RAYON BANGKALAN MENGGUNAKAN METODE SMARTER DAN FORWARD CHAINING,"Beasiswa  indentik  dengan  penghargaan yang  diberikan  kepada  pelajar/santri  berprestasi dalam  studi  yang  ditempuhnya.  IKSASS dalam  menumbuhkan  dan  meningkatkan semangat  santri  untuk  berprestasi dilakukan  dengan  memberikan  penghargaan  berupa  beasiswa  tiap  semester. Proses  seleksi  calon penerima beasiswa di Ikatan Santri Alumni Salafiyah Syafiiyah (IKSASS) Rayon Kabupaten Bangkalan dilengkapi  dengan  berbagai  kriteria. Seperti ekonomi keluarga, tanggungan keluarga, status orang tua dan lain-lain. Hal tersebut perlu  diperhatikan  dalam  perhitungan  penilaian  terhadap  kriteria  dan harus benar-benar relevan karena pada dasarnya akan berpengaruh pada hasil akhirnya. Dengan menggunakan Sistem Pendukung keputusan, calon penerima beasiswa menggunakan metode SMARTER inferensi Forward Chaining yang akan dibuat, hasil yang  didapat  telah  memenuhi  kriteria  yang  diinginkan  pihak IKSASS. Selain itu penggunaaan Forward Chaining efektif digunakan untuk mengantisipasi kesamaan hasil perankingan. Sehingga proses seleksi calon penerima beasiswa IKSASS rayon bangkalan tepat sasaran.

Kata kunci : sistem pendukung keputusan, Simple Multi-Atribute Rating  Technique Exploiting Rank (SMARTER), Forward Chaining.
"
PENERAPAN MODIFIKASI METODE ENHANCED CONFIX STRIPPING STEMMER PADA TEKS BERBAHASA MADURA,"Stemming adalah teknik untuk menemukan kata dasar dari sebuah kata yang telah mengalami imbuhan dengan cara menghilangkan atau menghapus imbuhan-imbuhan tersebut. Algoritma Enhanced Confix Stripping Stemmer adalah algoritma stemming yang akurat untuk mencari bentuk dasar dari suatu kata dalam Bahasa Indonesia. Bahasa Madura memiliki struktur morfologi yang mirip dengan Bahasa Indonesia. Bahasa Madura memiliki kata yang dapat dibentuk dari awalan (ter-ater), akhiran (panoteng) dan sisipan (sesselan) dan Kata Ulang (Rangkebbhan). Modifikasi algoritma Enhanced Confix Stripping Stemmer dilakukan pada tabel aturan pemenggalan, langkah-langkah algoritma dan penambahan langkah algoritma sesuai dengan morfologi Bahasa Madura. Dengan demikian dapat dihasilkan sebuah algoritma baru yang dikembangkan dari algoritma Enhanced Confix Stripping Stemmer. Setelah melakukan beberapa analisa dan pengujian dengan menggunakan sistem yang telah dibangun maka diperoleh hasil dari modifikasi algoritma Enhanced Confix Stripping Stemmer pada teks berbahasa Madura. Persentase kata Bahasa Madura yang berhasil distemming adalah 95,75 %  dari 400 kata yang diuji. Dengan demikian modifikasi Enhanced Confix Stripping Stemmer pada teks berbahasa Madura dinilai efektif untuk diterapkan."
Aplikasi Penerjemah Bahasa Madura-Indonesia Dan Indonesia-Madura Menggunakan Free Contex Parsing Algorithm,"Bahasa Madura sebagai salah satu bahasa daerah di Indonesia sudah mulai kehilangan identitas. Hal ini disebabkan minimnya pengetahuan dan sedikitnya pola pelestarian terhadap Bahasa Madura. Oleh karena itu, perlu adanya pola pembelajaran yang lebih efektif agar transformasi pengetahuan terus berjalan. Salah satunya dengan membuat aplikasi penerjemah Bahasa Madura-Indonesia dan juga sebaliknya. Untuk dapat menerjemahkan kata ataupun kalimat tersebut, dalam penelitian ini digunakan metode Free Context Parsing Algorithm. Dengan adanya aplikasi ini dapat menjadi referensi dalam mempelajari dan meningkatkan kemampuan berbahasa, mulai dari tingkatan Bahasa Madura yang paling umum (Enje’-Iyeh) hingga ke tingkatan Bahasa Madura yang paling halus (Engghi-Bunten), sehingga Bahasa Madura dapat bertahan dan lebih dikenal oleh masyarakat Madura maupun masyarakat luar Madura. Karena aplikasi yang berbasis web ini mampu menerjemahkan bahasa mulai dari Bahasa Madura ke Bahasa Indonesia dan dari Bahasa Indonesia ke Bahasa Madura. Dari hasil pengujian yang dilakukan terhadap beberapa kalimat dan dokumen, sistem ini sudah dapat dimengerti dan hasilnya cukup baik. Hal ini dibuktikan dengan  rata-rata nilai presisi yang diperoleh sebesar 90%. Namun, masih terdapat kekurangan pada hasil terjemahan yang belum sempurna dari segi tata Bahasa Madura.

Kata kunci: Aplikasi Penerjemah Bahasa, Free Contex Parsing Algorithm.
"
PENJADWALAN PRODUKSI ROKOK MENGGUNAKAN METODE SHORTEST PROCESSING TIME UNTUK MENDUKUNG PENERAPAN SUPPLY CHAIN MANAGEMENT,"Dalam pola supply chain management terdapat aktivitas penjadwalan produksi. Perubahan penjadwalan pada produksi merupakan hal yang sering terjadi untuk memenuhi permintaan konsumen, Penjadwalan produksi merupakan salah satu fungsi dari pengawasan produksi yang mempunyai peranan yang cukup penting dalam  memaksimalkan pendapatan penjualan, dan meminimalkan biaya produksi, dan proses produksi akan berjalan dengan efisien. Sedangkan proses produksi berjalan dengan efisien, maka proses supply chain management mengalir dengan lancar. Permasalahan yang ada di perusahaan rokok gudang alam, tidak adanya penjadwalan produksi pada perusahaan tersebut, dan pihak sales tidak tahu kapan barang akan dikirim. Dan pihak pemesan atau agen tidak mengetahui kapan barangnya bisa diterima, sehingga proses supply chain management tidak berjalan dengan baik. Dalam penelitian ini, diadakan   pengalokasian bahan-bahan baku dan bahan-bahan pembantu, serta kelengkapan pengolahan  di setiap instalasi atau fasilitas yang telah ditentukan untuk menunjang proses supply chain berjalan dengan baik. Hasil dari penjadwalan meliputi jumlah produk yang dihasilkan dan pengolahan pada produk tersebut, terutama pada bagian yang didahulukan dalam proses produksi untuk melakukan penjadwalan produksi rokok. Yang pada pengurutannya menggunakan metode shortest processing time, menghasilkan penjadwalan produksi rokok yang meminimalisir keterlambatan sesuai dengan permintaan konsumen.

Kata Kunci: Penjadwaln produksi, Shortest Processing Time, supply chain management
"
Sistem Pemilihan Supplier di Apotek Menggunakan Metode Fuzzy Analytical Network Process (FANP),"Kegiatan yang dilakukan di apotek yaitu transaksi penjualan obat kepada konsumen dan pembelian obat dari supplier. Karena suplier yang datang banyak, maka pihak apotek harus memilih suplier yang tepat, supaya usaha apotek dapat berjalan lancar. Untuk menyelesaikan permasalaha n di atas, pada penelitian ini dilakukan pendekatan Fuzzy Analytical Network Process (FANP) untuk memilih supplier obat terbaik untuk apotek. Penggunaan fuzzy bertujuan untuk mengakomodasi sifat samar dalam pengambilan keputusan untuk memberikan pertimbangan yang dapat mengatasi ketidakpastian didalam kriteria-kriteria kualitatif. Metode FANP dapat digunakan untuk menyelesaikan permasalahan pengambilan keputusan yang terdapat hubungan saling mempengaruhi antar kriteria dalam suatu level tertentu. Proses penghitungan FANP terhadap 5 supplier apotek Yakersuda yaitu Kallista, APL, AAM, Parit Padang dan Barito memperoleh hasil akhir bahwa terdapat 4 supplier yang mempunyai target sesuai dengan penilaian dari tiap kriteria dari perbandingan semua alternatif. Kriteria yang terpilih yaitu kualitas obat, ketepatan waktu, ketepatan jumlah, pengemasan, sistem komunikasi dan kerjasama, prosedur pembayaran, frekuensi pengiriman dan harga obat. Supplier yang terpilih yaitu Kallista, APL, AAM dan Barito dengan nilai bobot secara berturut-turut 3,19;3,19;3,19 dan 3,11. Hasil pemilihan tersebut memperoleh nilai prosentase sebesar 80% dari hasil verifikasi uji sistem.
Kata kunci: Sistem Pendukung Keputusan, Apotek, Perangkingan Supplier, Fuzzy Analytical Network Process (FANP)
"
Pengenalan Tulisan Tangan Carakan Jawa Secara Real Time  Dengan Menggunakan Dominant Point,"Pengenalan tulisan tangan adalah salah satu cabang dari pengenalan pola. Carakan merupakan tulisan yang cukup kompleks dan memiliki karakteristik yang lebih unik dibandingkan dengan tulisan latin, apalagi bila ditulis dengan tulisan tangan. Faktor yang menyebabkan proses pengenalan tulisan carakan sulit untuk dilakukan adalah variasi bentuk tulisan carakan dan memiliki kemiripan antar huruf. Hal ini memungkinkan adanya kesalahan dalam proses klasifikasi. Pada penelitian ini dibangun sistem pengenalan tulisan tangan secara real time dimana proses ekstraksi ciri menggunakan metode Dominant Point untuk mendapatkan ciri pada setiap karakter masukan. Metode ini pada dasarnya sistem akan membaca arah goresan pena yang didasarkan pada kumpulan titik. Pada proses klasifikasi serta pengenalan karakter menggunakan Fine Classification. Pada proses ini, pengenalan dilakukan dengan tiga tahap yaitu penilaian prakandidat, menyeleksi kandidat, lalu pencocokan karakter. Proses ini yang membuat sistem dengan cepat melakukan proses pengenalan. Dari uji coba yang dilakukan pada sistem, hasil terbaik untuk pengenalan citra huruf tulisan tangan carakan diperoleh dari data pelatihan sebanyak 600 citra pada data uji coba skenario ke 3 dengan akurasi sebesar 90%. Sedangkan hasil terendah diperoleh dari data pelatihan sebanyak 200 citra pada data uji coba skenario ke 1 dengan akurasi sebesar 40%. Hasil akurasi rata-rata dari sembilan skenario adalah sebesar 67,67%.

Kata kunci: Handwriting Recognition, Carakan, Dominant Point,  Fine Classification."
RANCANG BANGUN SISTEM PERAMALAN DISTRIBUSI BERAS MENGGUNAKAN METODE EXPONENTIAL SMOOTHING,"Salah satu komponen penting yang menunjang operasi perusahaan beras adalah 
kegiatan memprediksi jumlah beras yang dibutuhkan konsumen. Dengan prediksi 
yang baik dapat dibuat rencana kerja perusahaan lebih efektif dan efisien.  Proses 
pendistribusian juga harus tepat agar tidak terjadi penumpukan beras di gudang yang 
megakibatkan kwalitas beras menurun.  Selain itu  pemasukan beras  dan distribusi 
beras juga harus seimbang supaya terjadi keseimbangn dalam proses distribusi beras. 
Penelitian ini  mengidentifikasi pola distribusi beras  di BULOG kabupaten 
Pamekasan. agar  mendapatkan metode peramalan yang terbaik berdasarkan pola data 
pendistribusian beras. Selain itu sistem yang di buat juga mampu mendapatkan hasil 
peramalan  periode selanjutnya  sehingga dapat menjadi acuan dalam perencanaan 
strategi pendistribusian yang  diterapkan di Bulog  Kabupaten  Pamekasan.  Dalam 
proses pendistribusian  beras  Penentuan metode  exponential smooting  sebagai 
peramalan yang terbaik  dengan menggunakan data sebelumnya sebagai parameter 
masukan  dilakukan dengan  cara mengukur tingkat kesalahan  peramalan  dari 
penerapan  metode tersebut  dan di ketahui peramalan terbaik berada di  alpha  0.1 
dengan mengidentifikasi nilai Square Error  (SE) dan Percentage Error  (PE). Dapat 
diketahui melalui pencarian nilai rata-rata kesalahan sebesar 3.8%, yaitu menghitung 
Mean Square Error (MSE) dan Mean Absolute Percentage Error (MAPE). 
 
 Kata kunci:  Peramalan Pendistribusian, Exponential Smoothing, Mean Error (MSE) 
Mean Absolute Percentage Error (MAPE) "
SISTEM PERAMALAN TINGKAT PENGANGGURAN WILAYAH BANGKALAN MENGGUNAKAN ALGORITMA BACKPROPAGATION,"Kabupaten Bangkalan Mempunyai jumlah penduduk tahun 2010 sebanyak 906.761 yang diikuti dengan jumlah pengangguran yang cukup tinggi, tentunya pengangguran menjadi masalah sosial yang harus diperhatikan.  Berdasarkan permasalahan tersebut maka perlu adanya sistem peramalan sehingga bisa menekan angka pengangguran di Kabupaten Bangkalan. Sistem ini dibuat menggunakan Algoritma Backpropagation yang mampu melakukan penyesuaian bobot penghubung sehingga dapat dijadikan solusi untuk menentukan jumlah pengangguran. Jaringan-jaringan dilatih dengan menggunakan beberapa variabel masukan yaitu : data tahun 2006-2010. Setelah Sistem peramalan dengan menggunakan Algoritma Backpropagation ini melalui proses uji coba didapatkan nilai konfigurasi parameter terbaik ialah konfigurasi lerning rate sebesar 0.7 toleransi error 0.1, maksimal epoch 50 dan hidden layer 14.  Parameter tersebut dipilih menjadi parameter terbaik karena menghasilkan jumlah iterasi yang memiliki nilai akurasi error terbaik saat sistem melakukan pengujian yaitu didapatkan MSE sebesar 37206,6 dan MAPE sebesar 1,34% yang mana diperoleh jumlah pengangguran di Kabupaten Bangkalan pada tahun 2010 adalah 24.637 jiwa. Sedangkan pendataan jumlah pengangguan tahun 2010 yang dilakukan oleh BPS Kabupaten Bangakalan adalah 25008 jiwa.
	
Kata Kunci: Peramalan, Algoritma Backpropagation, Pengangguran.
"
