Judul,Abstraksi
SISTEM PENDUKUNG KEPUTUSAN PEMILIHAN KARYAWAN BERPRESTASI DENGAN INTEGRASI FAHP dan ELECTRE II,Sumber daya manusia mutlak dibutuhkan untuk kemajuan suatu perusahaan guna menjadikan perusahaan itu menjadi perusahaan yang maju dan tidak kalah bersaing dengan perusahaan lainnya. Dalam hal ini maka dibuatlah Sistem Pendukung keputusan (SPK) pemilihan karyawan berprestasi untuk mencari karyawan berprestasi. Sistem Pendukung keputusan (SPK) ini menggunakan FAHP dan ELECTRE II. Metode FAHP merupakan metode yang cukup obyektif untuk proses penilaian berdasarkan hirarki kriteria yang digabungkan dengan konsep fuzzy sesuai kriteria penilaian kinerja karyawan perusahaan. Setelah mendapat bobot dilakukan proses selanjutnya dengan menggunakan metode ELECTRE II hingga mendapat karyawan berprestasi. Untuk menjaga bahwa penilaian ini tidak berpihak kepada salah satu karyawan dan bebas intervensi dari karyawan maka perusahaan menggunakan pihak luar yang independen dan profesional untuk melakukan penilaian terhadap karyawan. Hasil penilaian dari pihak luar yang berupa angka-angka kemudian oleh departemen sdm dilakukan penjumlahan nilai komulatif kriteria untuk mendapat karyawan terbaik tanpa ada prioritas kriteria yang lebih penting. Dengan menggunakan metode FAHP dan ELECTREII hasil keluaran mendekati keakuratan dengan hasil yang diperoleh dari areal manager di banding dengan hitung manual perusahaan tanpa memperhatikan bobot kepentingan.
PENGELOMPOKAN KUALITAS KELAS PADA SISWA MENGGUNAKAN INDEKS DAVIES-BOULDIN SOM (SELF ORGANIZING MAP),"ABSTRAK
Data yang terdapat pada SMA Wachid Hasyim 2 Taman-Sepanjang merupakan data siswa yang masih mentah sehingga data tersebut perlu diolah. Pengolahan data dengan mengelompokan (Clustering) data-data tersebut memiliki beragam metode salah satunya adalah SOM (Self Organizing Map). Untuk menvalidasi data setelah Penggunaan distance matrix digunakan IDB (Indeks Davies-Bouldin). IDB dalam SOM bertujuan untuk meningkatkan akurasi validasi hasil analisa data. Pada akhirnya penganalisaan data dengan studi kasus SMA Wachid Hasyim 2 Taman-Sepanjang ini bertujuan untuk mengetahui tingkat kemiripan siswa dalam satu kelompok (per kelas). Metode SOM mampu mengelompokan data yang berdekatan untuk dicari kemiripannya berdasarkan pola. Kemiripan data pada pengelompokan siswa yang dijadikan tiga cluster dengan learning rate 0.6 serta epoch 10, 20, 30  dengan MSE terkecil = 41.42 di epoch 30 pada 245 data training. Sedangkan yang dijadikan tiga sampai dengan sembilan Cluster dengan learning rate 0.6 serta epoch 10, 20, 30 dengan MSE terkecil = 25.04 di epoch 20 pada cluster  ke-4 dengan  245 data training. Nilai terkecil pada pemvalidasian Cluster dengan IDB menggunakan tiga sampai dengan sembilan Cluster pada 245 data training berada pada  cluster ke-9 dengan nilai IDB = 37.44  dan hasilnya  kurang akurat karena kelas yang terbentuk hanya dua kelompok.


Kata kunci:  Clustering, SOM, Eucledian Distance, IDB, SMA Wachid Hasyim 2 Taman-Sepanjang
"
APLIKASI CITRA MOSAIC PANORAMIC MENGGUNAKAN METODE SIFT (SCALE INVARIANT FEATURE TRANSFORM),"Sebuah citra banyak diterapkan dalam berbagai aspek kehidupan, misalnya dalam bidang kedokteran untuk mengetahui bagian dalam tubuh manusia atau mendeteksi penyakit, dalam bidang geologi untuk memetakan suatu wilayah tertentu, dan lain sebagainya. Oleh karena itu dibutuhkan suatu tampilan citra yang dapat merepresentasikan suatu obyek. Namun batasan luas citra sering menjadi kendala dalam penerapan fungsi maupun manfaat citra itu sendiri. Untuk itu diperlukan aplikasi penggabungan citra atau mosaic panoramic yang dapat memperluas tampilan citra, sehingga dapat lebih bermanfaat untuk memberikan informasi suatu obyek tertentu. Pada penelitian ini menggunakan metode Scale Invariant Feature Transform (SIFT) untuk pendeteksian keypoint. Jumlah keypoint dapat berubah berdasarkan nilai threshold yang ditentukan. Dari 20 pasang citra yang diteliti, nilai threshold 0.1 pada 12 citra masukan jumlah keypoint yang berkesesuaian bernilai 0, sehingga tidak dapat dilakukan proses mosaic panoramic. Pada nilai threshold 0.6 jumlah keypoint yang berkesesuaian bernilai sedang dan dapat menghasilkan citra hasil mosaic panoramic. Sedangkan pada nilai threshold 0.9 jumlah keypoint yang berkesesuaian pada 14 pasang citra masukan atau 70% dari jumlah citra masukan semakin banyak ditemukan, sehingga  dapat dilakukan proses mosaic panoramic dan menghasilkan citra hasil mosaic panoramic yang lebih baik.

Kata Kunci:  Mosaic Panoramic, SIFT (Scale Invariant Feature Transform), Keypoint
"
PENGENALAN TELAPAK TANGAN MENGGUNAKAN METODE NAÏVE BAYES BERBASIS REDUKSI DIMENSI  PRINCIPAL COMPONENT ANALYSIS (PCA),"Teknologi biometrik saat ini mengalami perkembangan sangat pesat dan sudah lazim diterapkan pada berbagai bidang aplikasi. Proses pengenalan telapak tangan telah diteliti selama lebih dari 10 tahun.  Telapak tangan merupakan biometrika yang masih relatif baru. Telapak tangan memiliki beberapa karakteristik yang unik berupa garis telapak tangan dan bersifat stabil. Setiap orang mempunyai garis telapak tangan yang berbeda meskipun orang itu kembar. Keunikan dan kestabilan dari garis telapak tangan pada telapak tangan merupakan fitur handal setiap telapak tangan untuk digunakan pada sistem pengenalan. Dalam penelitian ini, proses pengenalan telapak tangan menggunakan metode Naive Bayes sebagai proses classifier dan  reduksi dimensinya menggunakan Principal Component Analysis (PCA). Sistem diuji coba menggunakan 100 citra telapak tangan dari 10 orang, setiap orang terdiri dari 10 sampel telapak tangan. Hasil pengujian rata-rata memperoleh persentase keberhasilan sebesar 51,45%."
Implementasi Sistem Pakar Pada Pengambilan Keputusan Penentuan Tindakan Medis di Poli Mata Berbasis Web,"Diagnosa penyakit mata dengan sistem informasi yang baik merupakan inti permasalahan pada penelitian ini. Diketahui pada studi kasus ini, dokter sebagai seorang pakar memiliki keterbatasan waktu dalam melayani pasien selama 24 jam, bahkan pada hari-hari selanjutnya. Dokter hanya bekerja tiga hari dalam satu minggu, dan 6 jam pada tiap kali melakukan pelayanan. Adanya asisten dokter juga belum dapat membantu pelayanan ini bekerja denga maksimal. Hal ini lah yang menjadi kurang maksimalnya peranan dokter bagi pasien. Terbatasnya keberadaaan dokter sebagai pakar dan minimnya waktu pelayanan dari dokter pada pasien nya serta minimnya pengetahuan seseorang terhadap gejala atas sakit yang dirasakan, sangat mendukung terdapatnya sistem yang mampu memberikan diagnosa dan solusi mengenai gejala yang diketahui. Berdasarkan hal tersebut, penelitian ini bertujuan untuk membuat aplikasi sistem pakar  berbasis web, yang  dapat mendiagnosa gejala penyakit pada mata. Metode yang digunakan dalam pengembangan aplikasi adalah Fuzzy Mamdani dengan Inferensi Forward Chainning. Input yang dibutuhkan pada sistem ini adalah data jenis gejala dan gejala umum yang diketahui, sedangkan output adalah nilai tingkat keparahan penyakit yang nantinya mengarah pada solusi dari tiap kasus. Dari hasil uji coba sistem yang dilakukan oleh dokter diperoleh nilai keakuratan sebesar 80% dari 10 kasus yang dilakukan. 

Kata kunci : Metode Fuzzy Mamdani, forward chaining , diagnosa penyakit mata.
"
RANCANG BANGUN SISTEM INFORMASI PEMETAAN TANAMAN PERTANIAN DI KABUPATEN BANGKALAN,"Kabupaten Bangkalan memiliki lahan pertanian seluas kurang lebih 98.683,38 Ha atau sekitar 79,03 % dari luas kabupaten Bangkalan seluruhnya. Lahan tersebut terdiri atas sawah teknis seluas 1.956,49 Ha tegal seluas 71.751,98 Ha, lahan kering mencapai 77.999,63 Ha yang tersebar di setiap kecamatan dengan topografi datar hingga berbukit. Namun demikian pembangunan pertanian mengalami hambatan karena selain kesuburan tanah rendah sebagian besar pembangunan pertanian masih tradisional  tanpa memerhatikan aspek kesesuaian lahan dan tanaman. Dalam tugas akhir ini dikembangkan sistem informasi pemetaan tanaman pertanian di kabupaten Bangkalan berbasis lahan. Penentuan jenis tanaman pada sistem berpedoman  pada hasil analisa kriteria kesesuaian jenis lahan dan jenis  tanaman dengan menggunakan metode matching dari Dinas Pertanian dan Peternakan Balai Penyuluhan Pertanian (BPP)  kabupaten Bangkalan. Data yang diperoleh diolah menjadi data spasial atau peta lokasi tanaman dengan memanfaatkan Google Maps sebagai aplikasi pemetaannya. Aplikasi Google Maps dipilih karena lebih memudahkan dalam mengetahui dan menentukan lokasi secara lebih detail. Penerapan aplikasi sistem informasi ini dapat membantu  pengguna khususnya petani dalam perencanaan dan pemilihan jenis tanaman yang sesuai untuk dikembangkan pada setiap kecamatan sehingga dapat meningkatkan produktivitas, kuantitas dan kualitas pertanian di kabupaten Bangkalan. 
	
Kata kunci: 	Kabupaten Bangkalan, Sistem Informasi, Google Maps, Lahan dan Tanaman.
"
SISTEM PEROLEHAN CITRA BERBASIS ISI MENGGUNAKAN WAVELET HAAR DAN EUCLIDEAN DISTANCE,"Batik merupakan seni yang paling penting dalam kehidupan masyarakat Indonesia. Keanekaragaman batik berasal dari beberapa wilayah diseluruh indonesia sehingga menyimbolkan karakteristik ciri pola batik yang berbeda-beda dari masing-masing daerah tempat batik tumbuh dan berkembang. Tugas Akhir ini telah berhasil membuat suatu Sistem Perolehan Citra berbasis Isi (SPCI) dengan ciri tekstur yang bertujuan untuk mengetahui ciri dari pola batik tersebut. SPCI merupakan metode atau teknik pencarian gambar citra yang mirip (similar) dengan melakukan perbandingan antara citra query dengan citra yang ada dalam basis data. Pada Penelitian  ini menggunakan ciri tekstur sebagai proses pencarian kemiripan dari delapan wilayah citra batik yang  berbeda yaitu: Cirebon, Bali, Bangkalan, Pamekasan, Sumenep, Yogyakarta, Solo, dan Pekalongan sebagai obyek perolehan citra berbasis isi. Metode yang digunakan pada penelitian ini berbasis tekstur kasar atau lembut yaitu metode Wavelet Haar. Wavelet Haar merupakan metode dimana pada setiap citra didekomposisi menjadi 4 bagian yaitu LL, LH, HL, dan HH. Pada masing-masing bagian tersebut ditentukan nilainya. Sehingga dari hasil ekstraksi fitur akan dilakukan pengukuran kemiripan dengan citra basis data dengan menggunakan metode Euclidean Distance. Citra query dan citra basis data yang dipergunakan sebanyak 200 citra dengan delapan kelas citra didalamnya. Citra tertinggi dari hasil uji coba skenario-skenario pada penelitian ini dapat diambil kesimpulan bahwa akurasi tertinggi ada pada kelas bangkalan, cirebon, pamekasan dan solo. Jumlah citra yang dihasilkan dari perhitungan akurasi adalah 8 citra yang mirip dari 10 citra terbaik yang ditampilkan berdasarkan fitur citra Roughness, yaitu fitur untuk mengetahui apakah sebuah tekstur tersebut kasar atau lembut. Dengan hasil nilai akurasi tertinggi sebesar 80 %."
SISTEM PERAMALAN KEBUTUHAN OBAT MENGGUNAKAN METODE JARINGAN SYARAF TIRUAN ALGORITMA  BACKPROPAGATION DENGAN FUNGSI LYAPUNOV,"Obat merupakan salah satu kebutuhan penting dalam rumah sakit. Selama ini, kebutuhan pengumpulan data obat adalah masalah yang sering dihadapi oleh Farmasi yang memiliki kewenangan dalam pengadaan obat-obatan di rumah sakit Dr H. Slamet Martodirdjo Pamekasan. Dalam rangka menjamin ketersediaan obat perlu untuk mengatasi kebutuhan obat sesuai dengan jumlah yang dibutuhkan. Dalam rangka memenuhi tingkat kebutuhan untuk obat perlu untuk meramalkan masa depan pasokan obat dengan menggunakan data sebelumnya sebagai data untuk menentukan nilai kesalahan pelatihan metode yang digunakan. Dalam penelitian ini, metode yang akan digunakan untuk memprediksi kebutuhan obat adalah Jaringan Syaraf menggunakan algoritma Backpropagation dengan penambahan fungsi Lyapunov. Dengan penambahan fungsi ini, mampu memecahkan masalah yang terjadi dalam Backpropagation standar sering lambat untuk mencapai konvergensi.
Dari uji coba yang dilakukan dengan 3 Skenario didapatkan hasil parameter terbaik untuk melakukan peramalan pada nama obat Ambroxol dengan  nilai (?) sebesar 13, learning rate 0.4 dan epoch=125 memperoleh  nilai MAPE  2.7% .  Obat Bisoprolol Tab 5mg dengan nilai (?) sebesar 2,  learning rater  0.5 dan epoch 150 memperoleh nilai MAPE  2,94089%.  Obat Cefixime Caps 100mg dengan  nilai (?) sebesar 4, learning rate   0.2  dan epoch 100  memperoleh nilai MAPE  1,10466%.
"
Visualisasi Proses Terjadinya Hujan Berbasis Second Life,"ABSTRAK
Perkembangan teknologi masa kini telah memungkinkan manusia untuk merasakan suatu pengalaman yang nyata tanpa perlu adanya dunia luar atau materi. Teknologi ini sering disebut teknologi virtual reality. Teknologi virtual reality dapat diterapkan di berbagai bidang salah satunya adalah didalam dunia pembelajaran. Didalam penelitian ini akan membuat suatu pembelajaran mengenai proses terjadinya hujan yang dikemas didalam simulasi virtual reality. Tujuan utama dari pengembangan virtual reality adalah untuk menirukan alam nyata ke dalam dunia maya semakin membuat kedekatan imitasi animasi realitas ke dalam dunia maya. Kehadiran teknologi virtual reality ini dimanfaatkan semaksimal mungkin dalam kehidupan sehari-hari. Didalam Penelitian ini ditetapkan perilaku yang menjadi objek adalah kegiatan proses terjadinya hujan. Kegunaan Second Life sebagai platform untuk menghidupkan konsep dalam pembelajaran proses terjadinya hujan menjadi 3 dimensi karena Second Life sangat memadai untuk memvisualisasikan sebuah bentuk 3D dan Second Life merupakan Platform yang sangat mendukung untuk membuat suatu pembelajaran. Hasil uji coba visualisasi terhadap responden mendapatkan suatu pembelajaran visualisasi proses hujan dengan cara yang berbeda dan menarik dan mudah dimengerti. 

Kata kunci: Virtual Reality (VR), Multimedia Proses Hujan, Second Life 
"
"PERANCANGAN SISTEM INFORMASI PERENCANAAN PRODUKSI DAN PERSEDIAAN BAHAN BAKU TINTA MENGGUNAKAN METODE EOQ 
(ECONOMIC ORDER QUANTITY)
(Studi Kasus Di PT Inktech Indahmulya)
","Penelitian ini membahas tentang perancangan sistem informasi perencanaan produksi dan persediaan bahan baku tinta menggunakan metode EOQ (Economic Order Quantity) di PT. Inktech Indahmulya. Selama ini dalam menjalankan rencana produksi yang ada masih menggunakan perencanaan produksi secara sederhana dan didasarkan pengalaman produksi periode-periode sebelumnya, sehingga perusahaan belum mengetahui apakah rencana produksi yang diterapkan sudah optimal. Untuk dapat menentukan jumlah persediaan barang secara tepat, diperlukan pengetahuan untuk mengetahui berapa jumlah barang yang dibutuhkan tiap periode dengan melakukan peramalan. Metode peramalan yang digunakan adalah metode single exponential smoothing dan metode single moving average, metode ini digunakan untuk melakukan peramalan kebutuhan bahan baku pada periode selanjutnya. Hasil penelitian ini mengkonfirmasikan  untuk menentukan jumlah tinta PMG yang harus diproduksi konsisten menggunakan metode peramalan single exponential smoothing dengan nilai MSE berada pada 0,1. Nilai tersebut digunakan untuk menentukan jumlah material produksi yang dibutuhkan dengan menggunakan metode Economic Order Quantity (EOQ). Dari hasil uji coba sistem ini didapatkan hasil biaya persediaan terendah dan jumlah kebutuhan bahan baku yang  diperlukan untuk periode selanjutnya."
ANALISIS PERAMALAN PENJUALAN PRODUK ASESORIS KOMPUTER MENGGUNAKAN METODE EXPONENTIAL SMOOTHING (ES) DAN ORDINARY LEAST SQUARE (OLS),"Dengan prediksi yang baik, dapat dibuat rencana kerja perusahaan lebih efektif dan efisien. Semakin banyak orang menggunakan Komputer  maka jumlah permintaan konsumen pada Asesoris komputer secara otomatis penjualannya juga akan meningkat. Oleh karena itu dibutuhkan sistem yang dapat memprediksi jumlah penjualan tiap minggunya agar perusahaan mendapatkan keuntungan yang maksimal. Untuk meramalkan pejualan Asesoris komputer Digunakanlah metode peramalan Single Exponential Smoothing (SES) dan metode Oldinary Least Square (OLS). Hasil peramalan tersebut akan dihitung  dan dibandingkan menggunakan Mean Square Error (MSE) untuk mendapatkan hasil error yang terkecil dan peramalan terbaik. Dari beberapa hasil tes perhitungan peramalan yang telah dilakukan dapat diambil kesimpulan bahwa proses peramalan penjualan asesoris komputer menggunakan metode Single Exponential Smoothing (SES) dan Oldinary Least Square (OLS) cukup baik diterapkan untuk studi kasus di SKY DISK Surabaya. Dengan mendapatkan rata-rata MSE sebesar 5257.5 dan rata-rata MAPE sebesar 0.9463%."
SISTEM INFORMASI GEOGRAFIS PEMETAAN WILAYAH BERDASARKAN TINGKAT KESEJAHTERAAN DI KABUPATEN BANGKALAN MENGGUNAKAN METODE FUZZY MAMDANI,"Menurut pemetaan yang dilakukan oleh Tim Nasional Percepatan Penanggulangan Kemiskinan (TNP2K) pada tahun 2011, kabupaten-kabupaten di pulau Madura memiliki masalah kemiskinan dan merupakan wilayah dengan prioritas 1 dan 2 dalam penanganan kerentanan pangan. Oleh karena itu penulis membuat sistem informasi geografis pemetaan wilayah berdasarkan tingkat kesejahteraan menggunakan metode Fuzzy Mamdani. Metode ini mengatasi keterlibatan objek yang memiliki ketidakpastian di dalam Sistem informasi geografis. Tahapan proses perhitungannya adalah: pembentukan himpunan fuzzy, aturan fungsi implikasi, komposisi aturan dan defuzzyfikasi (nilai z), yang kemudian akan diimplementasikan kedalam pemetaan, sehingga informasi dapat diperolah dengan cepat dan efisien. Dari uji coba yang dilakukan sistem Kec. Tragah dan Kec. Galis, tingkat kesejahteraannya kurang (pemetaan berwarna merah), dengan nilai “Kesejahteraan (Z)” (Z = 0,0). Sedangkan untuk Kec. Kamal (Z = 62,2), Kec. Tanah Merah (Z = 57,1), Kec. Modung (Z = 61,50), Kec. Arosbaya (Z = 61,4), Kec. Sepuluh (Z = 56,7), Kec. Klampis (Z = 65,00), Kec. Konang (Z = 63,7), Kec. Geger (Z = 55,7), Kec. Labang (Z = 56,6), Kec. Blega (Z = 55,9), Kec. Kwanyar (Z = 60,4), Kec. Burneh (Z = 56,10), Kec. Socah (Z = 60,8), Kec. Tanjung Bumi (Z = 57,7)dan Kec. Kokop (Z = 57,4) tingkat kesejahteraannya sedang (pemetaan berwarna kuning), Kec. Bangkalan (Z = 68,5) tingkat kesejahteraanya tinggi (pemetaan berwarna hijau).

Kata Kunci: Sistem Informasi Geografis, Fuzzy Mamdani, Tingkat Kesejahteraan
"
AUTO LEVELING BERBASIS FINITE STATE MACHINE (FSM) PADA GAME PEMBELAJARAN BAHASA INGGRIS,"Pengetahuan tentang bahasa Inggris pada jaman globalisasi saat ini sangatlah penting dan menjadi salah satu sarana untuk berkompetisi di segala bidang. Namun demikian, seringkali proses pembelajaran tidak dapat berjalan dengan lancar dikarenakan kurangnya metode pembelajaran yang kurang interaktif. Berangkat dari permasalahan tersebut maka dibangunlah sebuah game yang berunsur edukasi. Game berunsur edukasi harusnya menyenangkan dan tidak terlalu mudah atau terlalu sulit dimainkan  salah satunya dengan penerapan Artifical Intelegent (kecerdasan buatan). Dalam penelitian ini adalah bagaimana pemain mendapatkan tantangan (soal) sesuai dengan kemampuannya (pelevelan mandiri/auto leveling). Sehingga pemain tidak merasa frustasi (jika soalnya terlalu sulit) atau bosan (jika soalnya terlalu mudah). Metode yang dapat digunakan untuk membuat game yang mempunyai pelevelan mandiri adalah metode Finite State Machine (FSM) dan seluruhnya akan diimplementasikan kedalam game engine XNA. Dalam game pembelajaran bahasa Inggris ini terdapat speaking dan reading yang akan memanfaatkan teknologi speech recognition yang terdapat didalam XNA game studio. Dengan melakukan uji coba sistem kepada responden menghasilkan beberapa hal menjadikan game sebagai salah satu media pembelajaran, terciptanya game yang menarik dan menjadi game yang adaptif dengan penerapan perlevelan mandiri. Penggunaan speech recognition dapat meningkatkan kemampuan berbicara dalam bahasa Inggris. 

Kata Kunci : Education Game, Automatic Leveling, FSM (Finite State Machine), XNA game engine, Speech Recognition.
"
PENERAPAN METODE RADIAL BASIS FUNCTION NETWORK DENGAN K-MEANS CLUSTER UNTUK PERAMALAN KEBUTUHAN STRAW,"Berawal dari permintaan akan Straw (sperma beku) sapi yang tinggi untuk menghasilkan bibit unggul. Bidang Peternakan Dinas Kelautan, Perikanan dan Peternakan (DKPP) Sampang masih belum dapat menentukan berapa banyaknya Straw yang dibutuhkan pada saat permintaan itu datang. Sering terjadi stok Straw yang tersedia kurang memenuhi permintaan para peternak sapi, atau malah sebaliknya persediaan Straw yang ada masih banyak. Data yang digunakan adalah data penggunaan Straw di Kabupaten Sampang bulan Januari 2008 sampai Desember 2011. Peramalan kebutuhan Straw merupakan proses untuk memperkirakan jumlah kebutuhan Straw di masa datang. Metode peramalan yang digunakan dalam sistem ini adalah metode Radial Basis Function Network (RBFN) dengan penentuan hidden node menggunakan K-Means Cluster. Metode K-Means digunakan karena ketepatan penentuan nilai centroid yang akurat, mudah dan penentuannya awalnya secara random. Sedangkan dalam penentuan nilai error menggunakan MAPE (Mean Absolute Percentage Error) dan MSE (Mean Square Error). Dalam uji coba sistem diketahui bahwa sistem mampu memprediksi kebutuhan Straw satu bulan kedepan. Dari evaluasi kinerja sistem diketahui bahwa nilai MAPE dan MSE terkecil diperoleh pada jumlah cluster=3 yang mempunyai Nilai MAPE 10.12%  dan MSE 0.0081."
IMPLEMENTASI  METODE N-GRAM PADA PEMBUATAN GAME FIGHTING MADURA BERBASIS ANDROID OS MOBILE,Teknologi mobile  game  berkembang  dengan  sangat  pesat. mobile  game memiliki  banyak  peminat  dari berbagai kalangan karena keragaman variasinya. Hal inilah yang menjadi dasar bagi para pengembang untuk terus  mengembangkan mobile  game. Pada  penelitian  ini  dibuat sebuah Game  Fighting dengan  platform Android. Game  Fighting adalah  salah  satu  genre  video  game  dimana  seorang  player  mengontrol  seorang karakter di layar permainan dan  melakukan pertarungan jarak dekat (close combat) dengan  seorang lawan. Game  fighting  dibuat  dengan  mengimplementasikan  Metode  N-gram.  Metode  N-gram  diterapkan  pada pembuatan  pergerakan  NPC  (Non  Playable  Character)  dalam  bertarung. NPC  dapat  memprediksi  gerakan lawan  selanjutnya  dengan  menggunakan  metode  N-gram.  Dari  30  gerakan  pertama  player  NPC  dapat memprediksi 9 gerakan dengan tepat. Prediksi akan menjadi semakin akurat dengan semakin banyaknya key yang tercipta. 6 dari 9 prediksi gerakan yang tepat terjadi antara pada gerakan ke-20 sampai gerakan ke-30. Metode ini akan cenderung membuat NPC bertahan jika player bergerak agresif menyerang. Hasil pengujian Game  Fighting  dapat  berjalan  dengan  baik  pada  emulator  dan  smartphone  android  yang  memiliki  resolusi screen 320 x 480 pixels. Aplikasi game ini masih dapat berjalan lancar pada tipe smartphone Android yang memiliki  resolusi  screen  lebih  besar  atau  lebih  kecil  dari 320  x  480  pixels  akan  tetapi  tampilannya  tidak sempurna. 
"IMPLEMENTASI PERFORMANCE PRISM 
UNTUK SISTEM PENGUKURAN KINERJA PERUSAHAAN","Pengukuran kinerja adalah proses di mana organisasi menetapkan parameter hasil untuk dicapai oleh program, investasi, dan akusisi yang dilakukan. Dalam pengukuran kinerja perusahaan diperlukan indikator yang jelas sehingga bisa diketahui peningkatan atau penurunan indeks produktivitas yang menjadi tolak ukur perusahaan dalam mengukur kinerjanya. Pengukuran kinerja salah satunya diterapkan pada PT. Preshion Engineering Plastec Surabaya supaya  tetap  dapat menguasai  pasar  dan  mempertahankan  pelanggannya. Dengan menggunakan Performance Prism, metode ini mempertimbangkan semua kebutuhan dan keinginan dari semua stakeholder yang nantinya akan dijadikan dasar untuk menyusun Key Performance Indicators (KPI) kemudian KPI tersebut dibobotkan dengan ANP selanjutnya dilakukan scoring dengan Objective Matrix (OMAX) untuk mengetahui indeks produktivitas dari kinerja perusahaan. Hasil dari penelitian ini adalah dalam mengevaluasi kinerja PT Preshion Engineering Plastec Surabaya didapatkan 6 stakeholder dengan 19 subkriteria atau KPI. Dari 19 KPI tersebut, KPI Profit Growth  mendapatkan bobot normal paling tinggi yaitu 0,05307 dan KPI jumlah rapat bobotnya paling rendah yaitu 0,05262. Indeks produktivitas perusahaan pada tahun 2010 mengalami penurunan sebesar 0,29642 dari tahun 2009. Ini diakibatkan sebanyak 15 KPI pencapaiannya dibawah target. Namun untuk tahun 2011 indeks produktivitas perusahaan mengalami kenaikan dari tahun 2010 sebesar 0,420018."
PENGEMBANGAN VIRTUAL CLASS UNTUK PEMBELAJARAN INTERAKTIF MATA PELAJARAN MATEMATIKA SISWA SMP BERBASIS SECOND LIFE,"Internet berkembang dengan cepat beberapa tahun belakangan ini. Banyak hal yang dapat dilakukan dengan internet dari bergabung dengan situs jejaring sosial, bermain games online, belanja melalui shop online, download dan browsing info-info yang dibutuhkan. Bukan hanya itu dunia pendidikan juga ikut meramaikan dunia internet, seperti pembelajaran jarak jauh, virtual class, games pendidikan dan lain-lain. Dalam tugas akhir ini membangun aplikasi virtual class matematika untuk siswa SMP berbasis second life. Tujuan utama dari tugas akhir ini adalah untuk membuat suatu media pembelajaran dengan menerapkan teknologi yang ada yaitu, mata pelajaran yang virtual class matematika berbasis second life. Virtual Class ini dibuat secara online dengan menggunakan Second Life. Aplikasi virtual class ini terbagi dari 6 bab materi mata pelajaran matematika, khususnya untuk siswa SMP kelas VII. Didalam virtual class ini terdapat soal evaluasi untuk setiap babnya.Jika nilai evaluasi kurang dari KKM (Kriteria Kelulusan Minimal) maka siswa wajib melakukan pendalaman materi dan evaluasi ulang. Disini KKM nya menggunakan KKM mata pelajaran matematika untuk siswa VII SMP Negeri 1 Tulangan, yaitu dengan Nilai 75. Kendala dari uji coba aplikasi ini adalah kurangnya koneksi internet yang kuat, karena Aplikasi bersifat online dan memperlukan konekasi internet yang lumayan tinggi

Kata Kunci :  Internet, Virtual Class, Second Life, matematika

"
